var MASTER_SCHEDULE_CONST = 35;
 
var resources =  [
{
"@odata.etag":"W/\"5152647\"",
"_hub_deliverytype_value@OData.Community.Display.V1.FormattedValue":"Group Facilitation",
"_hub_deliverytype_value@Microsoft.Dynamics.CRM.associatednavigationproperty":"hub_deliverytype",
"_hub_deliverytype_value@Microsoft.Dynamics.CRM.lookuplogicalname":"hub_deliverytype",
"_hub_deliverytype_value":"d6493b3e-4e35-e711-80ed-c4346bad526c",
"_hub_centerid_value@OData.Community.Display.V1.FormattedValue":"Better Education, Inc.",
"_hub_centerid_value@Microsoft.Dynamics.CRM.associatednavigationproperty":"hub_centerid",
"_hub_centerid_value@Microsoft.Dynamics.CRM.lookuplogicalname":"hub_center",
"_hub_centerid_value":"46ecf508-e26d-e711-80f2-c4346bacfbbc",
"hub_name":"Area 2",
"hub_capacity@OData.Community.Display.V1.FormattedValue":"2",
"hub_capacity":2,
"hub_center_resourcesid":"fc007d16-dfc9-e711-8100-c4346badc680",
"adeliverytype_x002e_hub_name":"Group Facilitation",
"adeliverytype_x002e_hub_code@OData.Community.Display.V1.FormattedValue":"GF",
"adeliverytype_x002e_hub_code":2
},
{
"@odata.etag":"W/\"3189660\"",
"_hub_deliverytype_value@OData.Community.Display.V1.FormattedValue":"Group Facilitation",
"_hub_deliverytype_value@Microsoft.Dynamics.CRM.associatednavigationproperty":"hub_deliverytype",
"_hub_deliverytype_value@Microsoft.Dynamics.CRM.lookuplogicalname":"hub_deliverytype",
"_hub_deliverytype_value":"d6493b3e-4e35-e711-80ed-c4346bad526c",
"_hub_centerid_value@OData.Community.Display.V1.FormattedValue":"Better Education, Inc.",
"_hub_centerid_value@Microsoft.Dynamics.CRM.associatednavigationproperty":"hub_centerid",
"_hub_centerid_value@Microsoft.Dynamics.CRM.lookuplogicalname":"hub_center",
"_hub_centerid_value":"46ecf508-e26d-e711-80f2-c4346bacfbbc",
"hub_name":"Area-1",
"hub_capacity@OData.Community.Display.V1.FormattedValue":"3",
"hub_capacity":3,
"hub_center_resourcesid":"2f233e82-ab77-e711-80f3-c4346bad526c",
"adeliverytype_x002e_hub_name":"Group Facilitation",
"adeliverytype_x002e_hub_code@OData.Community.Display.V1.FormattedValue":"GF",
"adeliverytype_x002e_hub_code":2
},
{
"@odata.etag":"W/\"3815622\"",
"_hub_deliverytype_value@OData.Community.Display.V1.FormattedValue":"Group Instruction",
"_hub_deliverytype_value@Microsoft.Dynamics.CRM.associatednavigationproperty":"hub_deliverytype",
"_hub_deliverytype_value@Microsoft.Dynamics.CRM.lookuplogicalname":"hub_deliverytype",
"_hub_deliverytype_value":"f8b0e613-a534-e711-80ed-c4346bad526c",
"_hub_centerid_value@OData.Community.Display.V1.FormattedValue":"Better Education, Inc.",
"_hub_centerid_value@Microsoft.Dynamics.CRM.associatednavigationproperty":"hub_centerid",
"_hub_centerid_value@Microsoft.Dynamics.CRM.lookuplogicalname":"hub_center",
"_hub_centerid_value":"46ecf508-e26d-e711-80f2-c4346bacfbbc",
"hub_name":"Class-1",
"hub_capacity@OData.Community.Display.V1.FormattedValue":"2",
"hub_capacity":2,
"hub_center_resourcesid":"fcc3049d-ab77-e711-80f3-c4346bad526c",
"adeliverytype_x002e_hub_name":"Group Instruction",
"adeliverytype_x002e_hub_code@OData.Community.Display.V1.FormattedValue":"GI",
"adeliverytype_x002e_hub_code":3
},
{
"@odata.etag":"W/\"5151318\"",
"_hub_deliverytype_value@OData.Community.Display.V1.FormattedValue":"Group Instruction",
"_hub_deliverytype_value@Microsoft.Dynamics.CRM.associatednavigationproperty":"hub_deliverytype",
"_hub_deliverytype_value@Microsoft.Dynamics.CRM.lookuplogicalname":"hub_deliverytype",
"_hub_deliverytype_value":"f8b0e613-a534-e711-80ed-c4346bad526c",
"_hub_centerid_value@OData.Community.Display.V1.FormattedValue":"Better Education, Inc.",
"_hub_centerid_value@Microsoft.Dynamics.CRM.associatednavigationproperty":"hub_centerid",
"_hub_centerid_value@Microsoft.Dynamics.CRM.lookuplogicalname":"hub_center",
"_hub_centerid_value":"46ecf508-e26d-e711-80f2-c4346bacfbbc",
"hub_name":"Class-2",
"hub_capacity@OData.Community.Display.V1.FormattedValue":"10",
"hub_capacity":10,
"hub_center_resourcesid":"8871822c-d3c9-e711-8100-c4346badc680",
"adeliverytype_x002e_hub_name":"Group Instruction",
"adeliverytype_x002e_hub_code@OData.Community.Display.V1.FormattedValue":"GI",
"adeliverytype_x002e_hub_code":3
},
{
"@odata.etag":"W/\"3189659\"",
"_hub_deliverytype_value@OData.Community.Display.V1.FormattedValue":"Personal Instruction",
"_hub_deliverytype_value@Microsoft.Dynamics.CRM.associatednavigationproperty":"hub_deliverytype",
"_hub_deliverytype_value@Microsoft.Dynamics.CRM.lookuplogicalname":"hub_deliverytype",
"_hub_deliverytype_value":"d6c706eb-a534-e711-80ed-c4346bad526c",
"_hub_centerid_value@OData.Community.Display.V1.FormattedValue":"Better Education, Inc.",
"_hub_centerid_value@Microsoft.Dynamics.CRM.associatednavigationproperty":"hub_centerid",
"_hub_centerid_value@Microsoft.Dynamics.CRM.lookuplogicalname":"hub_center",
"_hub_centerid_value":"46ecf508-e26d-e711-80f2-c4346bacfbbc",
"hub_name":"Table-2",
"hub_capacity@OData.Community.Display.V1.FormattedValue":"2",
"hub_capacity":2,
"hub_center_resourcesid":"1881f55a-ab77-e711-80f3-c4346bad526c",
"adeliverytype_x002e_hub_name":"Personal Instruction",
"adeliverytype_x002e_hub_code@OData.Community.Display.V1.FormattedValue":"PI",
"adeliverytype_x002e_hub_code":1
},
{
"@odata.etag":"W/\"5270971\"",
"_hub_deliverytype_value@OData.Community.Display.V1.FormattedValue":"Personal Instruction",
"_hub_deliverytype_value@Microsoft.Dynamics.CRM.associatednavigationproperty":"hub_deliverytype",
"_hub_deliverytype_value@Microsoft.Dynamics.CRM.lookuplogicalname":"hub_deliverytype",
"_hub_deliverytype_value":"d6c706eb-a534-e711-80ed-c4346bad526c",
"_hub_centerid_value@OData.Community.Display.V1.FormattedValue":"Better Education, Inc.",
"_hub_centerid_value@Microsoft.Dynamics.CRM.associatednavigationproperty":"hub_centerid",
"_hub_centerid_value@Microsoft.Dynamics.CRM.lookuplogicalname":"hub_center",
"_hub_centerid_value":"46ecf508-e26d-e711-80f2-c4346bacfbbc",
"hub_name":"Table-3",
"hub_capacity@OData.Community.Display.V1.FormattedValue":"4",
"hub_capacity":4,
"hub_center_resourcesid":"e412b76d-037e-e711-80f4-c4346bad526c",
"adeliverytype_x002e_hub_name":"Personal Instruction",
"adeliverytype_x002e_hub_code@OData.Community.Display.V1.FormattedValue":"PI",
"adeliverytype_x002e_hub_code":1
}
];

var locations =  [
{
"@odata.etag":"W/\"5025003\"",
"hub_centername":"00313 - Success Opeartion, Inc.",
"hub_centerid":"de033d69-cdc6-e711-80ff-c4346bad526c",
"hub_centertype@OData.Community.Display.V1.FormattedValue":"Center",
"hub_centertype":true,
"_ownerid_value@OData.Community.Display.V1.FormattedValue":"00313 - Success Opeartion, Inc. Team",
"_ownerid_value@Microsoft.Dynamics.CRM.associatednavigationproperty":"ownerid",
"_ownerid_value@Microsoft.Dynamics.CRM.lookuplogicalname":"team",
"_ownerid_value":"cec72d62-cdc6-e711-80ff-c4346bad526c"
},
{
"@odata.etag":"W/\"5291542\"",
"hub_centername":"00913 - Society General Opeartion, Inc.",
"hub_centerid":"845f5f41-99d3-e711-8102-c4346badc680",
"hub_centertype@OData.Community.Display.V1.FormattedValue":"Center",
"hub_centertype":true,
"_ownerid_value@OData.Community.Display.V1.FormattedValue":"00913 - Society General Opeartion, Inc. Team",
"_ownerid_value@Microsoft.Dynamics.CRM.associatednavigationproperty":"ownerid",
"_ownerid_value@Microsoft.Dynamics.CRM.lookuplogicalname":"team",
"_ownerid_value":"40c3e538-99d3-e711-8102-c4346badc680"
},
{
"@odata.etag":"W/\"5262849\"",
"hub_centername":"00913 - Spencer Opeartion, Inc.",
"hub_centerid":"db9eda56-e7d0-e711-8102-c4346bacfbbc",
"hub_centertype@OData.Community.Display.V1.FormattedValue":"Center",
"hub_centertype":true,
"_ownerid_value@OData.Community.Display.V1.FormattedValue":"00913 - Spencer Opeartion, Inc. Team",
"_ownerid_value@Microsoft.Dynamics.CRM.associatednavigationproperty":"ownerid",
"_ownerid_value@Microsoft.Dynamics.CRM.lookuplogicalname":"team",
"_ownerid_value":"1f965b4f-e7d0-e711-8102-c4346bacfbbc"
},
{
"@odata.etag":"W/\"4597954\"",
"hub_centername":"04111 - Lovelace Learning Systems, Inc.",
"hub_centerid":"959b8eb3-e49d-e711-80f9-c4346badc680",
"hub_centertype@OData.Community.Display.V1.FormattedValue":"Center",
"hub_centertype":true,
"_ownerid_value@OData.Community.Display.V1.FormattedValue":"04111 - Lovelace Learning Systems, Inc. - Custom",
"_ownerid_value@Microsoft.Dynamics.CRM.associatednavigationproperty":"ownerid",
"_ownerid_value@Microsoft.Dynamics.CRM.lookuplogicalname":"team",
"_ownerid_value":"85fa7bad-e49d-e711-80f9-c4346badc680"
},
{
"@odata.etag":"W/\"4488657\"",
"hub_centername":"04112 - Nils & Stacia Bollen",
"hub_centerid":"3fcd58ed-c49a-e711-80f8-c4346bad526c",
"hub_centertype@OData.Community.Display.V1.FormattedValue":"Center",
"hub_centertype":true,
"_ownerid_value@OData.Community.Display.V1.FormattedValue":"04112 - Nils & Stacia Bollen - Custom",
"_ownerid_value@Microsoft.Dynamics.CRM.associatednavigationproperty":"ownerid",
"_ownerid_value@Microsoft.Dynamics.CRM.lookuplogicalname":"team",
"_ownerid_value":"3acd58ed-c49a-e711-80f8-c4346bad526c"
},
{
"@odata.etag":"W/\"4509893\"",
"hub_centername":"04117 - BBSR Achievement LLC",
"hub_centerid":"3c7f6292-6b90-e711-80f8-c4346badc680",
"hub_centertype@OData.Community.Display.V1.FormattedValue":"Center",
"hub_centertype":true,
"_ownerid_value@OData.Community.Display.V1.FormattedValue":"BBSR Achievement LLC - 04117 - Custom",
"_ownerid_value@Microsoft.Dynamics.CRM.associatednavigationproperty":"ownerid",
"_ownerid_value@Microsoft.Dynamics.CRM.lookuplogicalname":"team",
"_ownerid_value":"6a5ac27c-6b90-e711-80f8-c4346badc680"
},
{
"@odata.etag":"W/\"4488661\"",
"hub_centername":"05118 - Southwest San Antonio Learning LLC",
"hub_centerid":"299e6289-62a3-e711-80f9-c4346badc680",
"hub_centertype@OData.Community.Display.V1.FormattedValue":"Center",
"hub_centertype":true,
"_ownerid_value@OData.Community.Display.V1.FormattedValue":"05118 - Southwest San Antonio Learning LLC - Custom",
"_ownerid_value@Microsoft.Dynamics.CRM.associatednavigationproperty":"ownerid",
"_ownerid_value@Microsoft.Dynamics.CRM.lookuplogicalname":"team",
"_ownerid_value":"6c515f82-62a3-e711-80f9-c4346badc680"
},
{
"@odata.etag":"W/\"4495528\"",
"hub_centername":"05119 - Trident Capital Management, Inc.",
"hub_centerid":"16ab870c-77a3-e711-80f8-c4346bad526c",
"hub_centertype@OData.Community.Display.V1.FormattedValue":"Center",
"hub_centertype":true,
"_ownerid_value@OData.Community.Display.V1.FormattedValue":"05119 - Trident Capital Management, Inc. - Custom",
"_ownerid_value@Microsoft.Dynamics.CRM.associatednavigationproperty":"ownerid",
"_ownerid_value@Microsoft.Dynamics.CRM.lookuplogicalname":"team",
"_ownerid_value":"a5f01c06-77a3-e711-80f8-c4346bad526c"
},
{
"@odata.etag":"W/\"4487561\"",
"hub_centername":"1000 - ITC Center",
"hub_centerid":"469a245a-9b93-e711-80f7-c4346bacfbbc",
"hub_centertype@OData.Community.Display.V1.FormattedValue":"Center",
"hub_centertype":true,
"_ownerid_value@OData.Community.Display.V1.FormattedValue":"ITC Center Team",
"_ownerid_value@Microsoft.Dynamics.CRM.associatednavigationproperty":"ownerid",
"_ownerid_value@Microsoft.Dynamics.CRM.lookuplogicalname":"team",
"_ownerid_value":"424d1c58-9f93-e711-80f7-c4346bacfbbc"
},
{
"@odata.etag":"W/\"4488673\"",
"hub_centername":"10005 - Orenco Station - Hillsboro",
"hub_centerid":"56759c6f-32ad-e711-80fb-c4346bacfbbc",
"hub_centertype@OData.Community.Display.V1.FormattedValue":"Center",
"hub_centertype":true,
"_ownerid_value@OData.Community.Display.V1.FormattedValue":"10005 - Orenco Station - Hillsboro Team",
"_ownerid_value@Microsoft.Dynamics.CRM.associatednavigationproperty":"ownerid",
"_ownerid_value@Microsoft.Dynamics.CRM.lookuplogicalname":"team",
"_ownerid_value":"fee7bc68-32ad-e711-80fb-c4346bacfbbc"
},
{
"@odata.etag":"W/\"4487584\"",
"hub_centername":"1215 - Vancouver learning center",
"hub_centerid":"18794006-70ac-e711-80fc-c4346badc680",
"hub_centertype@OData.Community.Display.V1.FormattedValue":"Center",
"hub_centertype":true,
"_ownerid_value@OData.Community.Display.V1.FormattedValue":"1215 - Vancouver learning center - Custom",
"_ownerid_value@Microsoft.Dynamics.CRM.associatednavigationproperty":"ownerid",
"_ownerid_value@Microsoft.Dynamics.CRM.lookuplogicalname":"team",
"_ownerid_value":"d29244f4-6fac-e711-80fc-c4346badc680"
},
{
"@odata.etag":"W/\"5022745\"",
"hub_centername":"30213 - Success Amarillo, Inc.",
"hub_centerid":"8bcbe212-5cc6-e711-80ff-c4346bad526c",
"hub_centertype@OData.Community.Display.V1.FormattedValue":"Center",
"hub_centertype":true,
"_ownerid_value@OData.Community.Display.V1.FormattedValue":"30213 - Success Amarillo, Inc. Team",
"_ownerid_value@Microsoft.Dynamics.CRM.associatednavigationproperty":"ownerid",
"_ownerid_value@Microsoft.Dynamics.CRM.lookuplogicalname":"team",
"_ownerid_value":"e6569a0b-5cc6-e711-80ff-c4346bad526c"
},
{
"@odata.etag":"W/\"4809323\"",
"hub_centername":"30214 - MAX of Amarillo, Inc.",
"hub_centerid":"a626c22c-14c6-e711-8100-c4346badc680",
"hub_centertype@OData.Community.Display.V1.FormattedValue":"Center",
"hub_centertype":true,
"_ownerid_value@OData.Community.Display.V1.FormattedValue":"30214 - MAX of Amarillo, Inc. Team",
"_ownerid_value@Microsoft.Dynamics.CRM.associatednavigationproperty":"ownerid",
"_ownerid_value@Microsoft.Dynamics.CRM.lookuplogicalname":"team",
"_ownerid_value":"9e26c22c-14c6-e711-8100-c4346badc680"
},
{
"@odata.etag":"W/\"4619098\"",
"hub_centername":"30215 - SLC of Amarillo, Inc.",
"hub_centerid":"50107ba4-5ec5-e711-8100-c4346bacfbbc",
"hub_centertype@OData.Community.Display.V1.FormattedValue":"Center",
"hub_centertype":true,
"_ownerid_value@OData.Community.Display.V1.FormattedValue":"30215 - SLC of Amarillo, Inc. Team",
"_ownerid_value@Microsoft.Dynamics.CRM.associatednavigationproperty":"ownerid",
"_ownerid_value@Microsoft.Dynamics.CRM.lookuplogicalname":"team",
"_ownerid_value":"907f339c-5ec5-e711-8100-c4346bacfbbc"
},
{
"@odata.etag":"W/\"4618239\"",
"hub_centername":"30216 - Learning Depot, Inc.",
"hub_centerid":"cba755c2-53c5-e711-80ff-c4346bad526c",
"hub_centertype@OData.Community.Display.V1.FormattedValue":"Center",
"hub_centertype":true,
"_ownerid_value@OData.Community.Display.V1.FormattedValue":"30216 - Learning Depot, Inc. Team",
"_ownerid_value@Microsoft.Dynamics.CRM.associatednavigationproperty":"ownerid",
"_ownerid_value@Microsoft.Dynamics.CRM.lookuplogicalname":"team",
"_ownerid_value":"b00dab1b-53c5-e711-8100-c4346bacfbbc"
},
{
"@odata.etag":"W/\"4487551\"",
"hub_centername":"80098 - Rensel Insurance",
"hub_centerid":"8b7559ab-55a3-e711-80f8-c4346bac4304",
"hub_centertype@OData.Community.Display.V1.FormattedValue":"Satellite",
"hub_centertype":false,
"_ownerid_value@OData.Community.Display.V1.FormattedValue":"04112 - Nils & Stacia Bollen - Custom",
"_ownerid_value@Microsoft.Dynamics.CRM.associatednavigationproperty":"ownerid",
"_ownerid_value@Microsoft.Dynamics.CRM.lookuplogicalname":"team",
"_ownerid_value":"3acd58ed-c49a-e711-80f8-c4346bad526c",
"_hub_parentcenter_value@OData.Community.Display.V1.FormattedValue":"04112 - Nils & Stacia Bollen",
"_hub_parentcenter_value@Microsoft.Dynamics.CRM.associatednavigationproperty":"hub_ParentCenter",
"_hub_parentcenter_value@Microsoft.Dynamics.CRM.lookuplogicalname":"hub_center",
"_hub_parentcenter_value":"3fcd58ed-c49a-e711-80f8-c4346bad526c"
},
{
"@odata.etag":"W/\"4487571\"",
"hub_centername":"80099 - Max BU'PA Insurance",
"hub_centerid":"50ed780e-56a3-e711-80f8-c4346bad526c",
"hub_centertype@OData.Community.Display.V1.FormattedValue":"Satellite",
"hub_centertype":false,
"_ownerid_value@OData.Community.Display.V1.FormattedValue":"04112 - Nils & Stacia Bollen - Custom",
"_ownerid_value@Microsoft.Dynamics.CRM.associatednavigationproperty":"ownerid",
"_ownerid_value@Microsoft.Dynamics.CRM.lookuplogicalname":"team",
"_ownerid_value":"3acd58ed-c49a-e711-80f8-c4346bad526c",
"_hub_parentcenter_value@OData.Community.Display.V1.FormattedValue":"04112 - Nils & Stacia Bollen",
"_hub_parentcenter_value@Microsoft.Dynamics.CRM.associatednavigationproperty":"hub_ParentCenter",
"_hub_parentcenter_value@Microsoft.Dynamics.CRM.lookuplogicalname":"hub_center",
"_hub_parentcenter_value":"3fcd58ed-c49a-e711-80f8-c4346bad526c"
},
{
"@odata.etag":"W/\"5025000\"",
"hub_centername":"90056 - Arm Services",
"hub_centerid":"4552d0ec-cdc6-e711-80ff-c4346bac4304",
"hub_centertype@OData.Community.Display.V1.FormattedValue":"Satellite",
"hub_centertype":false,
"_ownerid_value@OData.Community.Display.V1.FormattedValue":"30215 - SLC of Amarillo, Inc. Team",
"_ownerid_value@Microsoft.Dynamics.CRM.associatednavigationproperty":"ownerid",
"_ownerid_value@Microsoft.Dynamics.CRM.lookuplogicalname":"team",
"_ownerid_value":"907f339c-5ec5-e711-8100-c4346bacfbbc",
"_hub_parentcenter_value@OData.Community.Display.V1.FormattedValue":"30215 - SLC of Amarillo, Inc.",
"_hub_parentcenter_value@Microsoft.Dynamics.CRM.associatednavigationproperty":"hub_ParentCenter",
"_hub_parentcenter_value@Microsoft.Dynamics.CRM.lookuplogicalname":"hub_center",
"_hub_parentcenter_value":"50107ba4-5ec5-e711-8100-c4346bacfbbc"
},
{
"@odata.etag":"W/\"5022753\"",
"hub_centername":"90077 - Success Educational Services",
"hub_centerid":"9dd73577-5cc6-e711-80ff-c4346bac4304",
"hub_centertype@OData.Community.Display.V1.FormattedValue":"Satellite",
"hub_centertype":false,
"_ownerid_value@OData.Community.Display.V1.FormattedValue":"30215 - SLC of Amarillo, Inc. Team",
"_ownerid_value@Microsoft.Dynamics.CRM.associatednavigationproperty":"ownerid",
"_ownerid_value@Microsoft.Dynamics.CRM.lookuplogicalname":"team",
"_ownerid_value":"907f339c-5ec5-e711-8100-c4346bacfbbc",
"_hub_parentcenter_value@OData.Community.Display.V1.FormattedValue":"30215 - SLC of Amarillo, Inc.",
"_hub_parentcenter_value@Microsoft.Dynamics.CRM.associatednavigationproperty":"hub_ParentCenter",
"_hub_parentcenter_value@Microsoft.Dynamics.CRM.lookuplogicalname":"hub_center",
"_hub_parentcenter_value":"50107ba4-5ec5-e711-8100-c4346bacfbbc"
},
{
"@odata.etag":"W/\"5022755\"",
"hub_centername":"90079 - Max Educational Services",
"hub_centerid":"46fd4368-5fc5-e711-8100-c4346bacfbbc",
"hub_centertype@OData.Community.Display.V1.FormattedValue":"Satellite",
"hub_centertype":false,
"_ownerid_value@OData.Community.Display.V1.FormattedValue":"30215 - SLC of Amarillo, Inc. Team",
"_ownerid_value@Microsoft.Dynamics.CRM.associatednavigationproperty":"ownerid",
"_ownerid_value@Microsoft.Dynamics.CRM.lookuplogicalname":"team",
"_ownerid_value":"907f339c-5ec5-e711-8100-c4346bacfbbc",
"_hub_parentcenter_value@OData.Community.Display.V1.FormattedValue":"30215 - SLC of Amarillo, Inc.",
"_hub_parentcenter_value@Microsoft.Dynamics.CRM.associatednavigationproperty":"hub_ParentCenter",
"_hub_parentcenter_value@Microsoft.Dynamics.CRM.lookuplogicalname":"hub_center",
"_hub_parentcenter_value":"50107ba4-5ec5-e711-8100-c4346bacfbbc"
},
{
"@odata.etag":"W/\"4618244\"",
"hub_centername":"90099 - Super Educational Services",
"hub_centerid":"70de127d-5ac5-e711-8100-c4346bacfbbc",
"hub_centertype@OData.Community.Display.V1.FormattedValue":"Satellite",
"hub_centertype":false,
"_ownerid_value@OData.Community.Display.V1.FormattedValue":"30216 - Learning Depot, Inc. Team",
"_ownerid_value@Microsoft.Dynamics.CRM.associatednavigationproperty":"ownerid",
"_ownerid_value@Microsoft.Dynamics.CRM.lookuplogicalname":"team",
"_ownerid_value":"b00dab1b-53c5-e711-8100-c4346bacfbbc",
"_hub_parentcenter_value@OData.Community.Display.V1.FormattedValue":"30216 - Learning Depot, Inc.",
"_hub_parentcenter_value@Microsoft.Dynamics.CRM.associatednavigationproperty":"hub_ParentCenter",
"_hub_parentcenter_value@Microsoft.Dynamics.CRM.lookuplogicalname":"hub_center",
"_hub_parentcenter_value":"cba755c2-53c5-e711-80ff-c4346bad526c"
},
{
"@odata.etag":"W/\"4487556\"",
"hub_centername":"A1 Education Services, Inc.",
"hub_centerid":"361a67d9-f962-e711-80f2-c4346bacfbbc",
"hub_centertype@OData.Community.Display.V1.FormattedValue":"Center",
"hub_centertype":true,
"_ownerid_value@OData.Community.Display.V1.FormattedValue":"A1 Education Services, Inc. - 00208 - Custom",
"_ownerid_value@Microsoft.Dynamics.CRM.associatednavigationproperty":"ownerid",
"_ownerid_value@Microsoft.Dynamics.CRM.lookuplogicalname":"team",
"_ownerid_value":"392ff082-f962-e711-80f2-c4346bad526c"
},
{
"@odata.etag":"W/\"5304578\"",
"hub_centername":"Ascension, LLC",
"hub_centerid":"53c0e87e-a96b-e711-80f3-c4346badc680",
"hub_centertype@OData.Community.Display.V1.FormattedValue":"Center",
"hub_centertype":true,
"_ownerid_value@OData.Community.Display.V1.FormattedValue":"Ascension, LLC - 00311 - Custom",
"_ownerid_value@Microsoft.Dynamics.CRM.associatednavigationproperty":"ownerid",
"_ownerid_value@Microsoft.Dynamics.CRM.lookuplogicalname":"team",
"_ownerid_value":"4ec0e87e-a96b-e711-80f3-c4346badc680"
},
{
"@odata.etag":"W/\"4487542\"",
"hub_centername":"Baltimore LC",
"hub_centerid":"805c32ee-7c35-e711-80ed-c4346bac4304",
"hub_centertype@OData.Community.Display.V1.FormattedValue":"Center",
"hub_centertype":true,
"_ownerid_value@OData.Community.Display.V1.FormattedValue":"babita khuntia",
"_ownerid_value@Microsoft.Dynamics.CRM.associatednavigationproperty":"ownerid",
"_ownerid_value@Microsoft.Dynamics.CRM.lookuplogicalname":"systemuser",
"_ownerid_value":"50afe85c-ba0f-e711-80e9-c4346bacfb24"
},
{
"@odata.etag":"W/\"5157648\"",
"hub_centername":"Bel Air Learning Center",
"hub_centerid":"b97bc0df-a334-e711-80ed-c4346bacfbbc",
"hub_centertype@OData.Community.Display.V1.FormattedValue":"Center",
"hub_centertype":true,
"_ownerid_value@OData.Community.Display.V1.FormattedValue":"Nagendra kumar",
"_ownerid_value@Microsoft.Dynamics.CRM.associatednavigationproperty":"ownerid",
"_ownerid_value@Microsoft.Dynamics.CRM.lookuplogicalname":"systemuser",
"_ownerid_value":"c2c4d087-ba0f-e711-80f9-c4346bada738"
},
{
"@odata.etag":"W/\"4487558\"",
"hub_centername":"Better Education, Inc.",
"hub_centerid":"46ecf508-e26d-e711-80f2-c4346bacfbbc",
"hub_centertype@OData.Community.Display.V1.FormattedValue":"Center",
"hub_centertype":true,
"_ownerid_value@OData.Community.Display.V1.FormattedValue":"Nagendra kumar",
"_ownerid_value@Microsoft.Dynamics.CRM.associatednavigationproperty":"ownerid",
"_ownerid_value@Microsoft.Dynamics.CRM.lookuplogicalname":"systemuser",
"_ownerid_value":"c2c4d087-ba0f-e711-80f9-c4346bada738"
},
{
"@odata.etag":"W/\"4487545\"",
"hub_centername":"BGA Education, Inc.",
"hub_centerid":"091865a6-df6a-e711-80f2-c4346bac4304",
"hub_centertype@OData.Community.Display.V1.FormattedValue":"Center",
"hub_centertype":true,
"_ownerid_value@OData.Community.Display.V1.FormattedValue":"BGA Education, Inc. - 00205 - Custom",
"_ownerid_value@Microsoft.Dynamics.CRM.associatednavigationproperty":"ownerid",
"_ownerid_value@Microsoft.Dynamics.CRM.lookuplogicalname":"team",
"_ownerid_value":"9d034635-df6a-e711-80f2-c4346bacfbbc"
},
{
"@odata.etag":"W/\"4487543\"",
"hub_centername":"Cascade Kids, Inc.",
"hub_centerid":"fa9d120b-955c-e711-80f1-c4346bac4304",
"hub_centertype@OData.Community.Display.V1.FormattedValue":"Center",
"hub_centertype":true,
"_ownerid_value@OData.Community.Display.V1.FormattedValue":"Cascade Kids, Inc. - 00104 - Custom",
"_ownerid_value@Microsoft.Dynamics.CRM.associatednavigationproperty":"ownerid",
"_ownerid_value@Microsoft.Dynamics.CRM.lookuplogicalname":"team",
"_ownerid_value":"b7020bc5-945c-e711-80f2-c4346badc680"
},
{
"@odata.etag":"W/\"5303189\"",
"hub_centername":"Catonsville Learning Center",
"hub_centerid":"f45b6933-9040-e711-80f0-c4346bad526c",
"hub_centertype@OData.Community.Display.V1.FormattedValue":"Center",
"hub_centertype":true,
"_ownerid_value@OData.Community.Display.V1.FormattedValue":"Catonsville Learning Center - Custom Team",
"_ownerid_value@Microsoft.Dynamics.CRM.associatednavigationproperty":"ownerid",
"_ownerid_value@Microsoft.Dynamics.CRM.lookuplogicalname":"team",
"_ownerid_value":"7d7cbdd0-8d40-e711-80f0-c4346bad526c"
},
{
"@odata.etag":"W/\"4487566\"",
"hub_centername":"CD5, LLC",
"hub_centerid":"e9cfb78f-9052-e711-80f1-c4346bad526c",
"hub_centertype@OData.Community.Display.V1.FormattedValue":"Center",
"hub_centertype":true,
"_ownerid_value@OData.Community.Display.V1.FormattedValue":"CD5, LLC - 00100 - Custom",
"_ownerid_value@Microsoft.Dynamics.CRM.associatednavigationproperty":"ownerid",
"_ownerid_value@Microsoft.Dynamics.CRM.lookuplogicalname":"team",
"_ownerid_value":"3ab85bde-8b52-e711-80f2-c4346badc680"
},
{
"@odata.etag":"W/\"5378344\"",
"hub_centername":"Columbia Learning Center",
"hub_centerid":"c03233cf-8f40-e711-80f0-c4346bad526c",
"hub_centertype@OData.Community.Display.V1.FormattedValue":"Center",
"hub_centertype":true,
"_ownerid_value@OData.Community.Display.V1.FormattedValue":"Custom Team - Columbia Learning Center",
"_ownerid_value@Microsoft.Dynamics.CRM.associatednavigationproperty":"ownerid",
"_ownerid_value@Microsoft.Dynamics.CRM.lookuplogicalname":"team",
"_ownerid_value":"9e49342c-8c40-e711-80f0-c4346bad526c"
},
{
"@odata.etag":"W/\"4487573\"",
"hub_centername":"Columbia Learning Center",
"hub_centerid":"7857097a-f666-e711-8102-c4346bada738",
"hub_centertype@OData.Community.Display.V1.FormattedValue":"Satellite",
"hub_centertype":false,
"_ownerid_value@OData.Community.Display.V1.FormattedValue":"Nagendra kumar",
"_ownerid_value@Microsoft.Dynamics.CRM.associatednavigationproperty":"ownerid",
"_ownerid_value@Microsoft.Dynamics.CRM.lookuplogicalname":"systemuser",
"_ownerid_value":"c2c4d087-ba0f-e711-80f9-c4346bada738",
"_hub_parentcenter_value@OData.Community.Display.V1.FormattedValue":"Better Education, Inc.",
"_hub_parentcenter_value@Microsoft.Dynamics.CRM.associatednavigationproperty":"hub_ParentCenter",
"_hub_parentcenter_value@Microsoft.Dynamics.CRM.lookuplogicalname":"hub_center",
"_hub_parentcenter_value":"46ecf508-e26d-e711-80f2-c4346bacfbbc"
},
{
"@odata.etag":"W/\"4487567\"",
"hub_centername":"Darcy Webb",
"hub_centerid":"78197243-e06d-e711-80f2-c4346bad526c",
"hub_centertype@OData.Community.Display.V1.FormattedValue":"Center",
"hub_centertype":true,
"_ownerid_value@OData.Community.Display.V1.FormattedValue":"Darcy Webb - 00214 - Custom",
"_ownerid_value@Microsoft.Dynamics.CRM.associatednavigationproperty":"ownerid",
"_ownerid_value@Microsoft.Dynamics.CRM.lookuplogicalname":"team",
"_ownerid_value":"73197243-e06d-e711-80f2-c4346bad526c"
},
{
"@odata.etag":"W/\"4487549\"",
"hub_centername":"Education Options, LLC",
"hub_centerid":"a298b1fd-e26d-e711-80f2-c4346bac4304",
"hub_centertype@OData.Community.Display.V1.FormattedValue":"Center",
"hub_centertype":true,
"_ownerid_value@OData.Community.Display.V1.FormattedValue":"Education Options, LLC - 00216 - Custom",
"_ownerid_value@Microsoft.Dynamics.CRM.associatednavigationproperty":"ownerid",
"_ownerid_value@Microsoft.Dynamics.CRM.lookuplogicalname":"team",
"_ownerid_value":"9d98b1fd-e26d-e711-80f2-c4346bac4304"
},
{
"@odata.etag":"W/\"5157152\"",
"hub_centername":"Good Apple Achievement LLC",
"hub_centerid":"648204a5-5c7b-e711-80f4-c4346bad526c",
"hub_centertype@OData.Community.Display.V1.FormattedValue":"Center",
"hub_centertype":true,
"_ownerid_value@OData.Community.Display.V1.FormattedValue":"Good Apple Achievement LLC - 04117 - Custom",
"_ownerid_value@Microsoft.Dynamics.CRM.associatednavigationproperty":"ownerid",
"_ownerid_value@Microsoft.Dynamics.CRM.lookuplogicalname":"team",
"_ownerid_value":"335f0f17-d779-e711-80f4-c4346bacfbbc"
},
{
"@odata.etag":"W/\"4487550\"",
"hub_centername":"Good Mango Achievement LLC",
"hub_centerid":"6c53be80-be88-e711-80f5-c4346bac4304",
"hub_centertype@OData.Community.Display.V1.FormattedValue":"Center",
"hub_centertype":true,
"_ownerid_value@OData.Community.Display.V1.FormattedValue":"Good Mango Achievement LLC - 04119 - Custom",
"_ownerid_value@Microsoft.Dynamics.CRM.associatednavigationproperty":"ownerid",
"_ownerid_value@Microsoft.Dynamics.CRM.lookuplogicalname":"team",
"_ownerid_value":"9c09a77a-be88-e711-80f5-c4346bac4304"
},
{
"@odata.etag":"W/\"4487560\"",
"hub_centername":"Good Orange Achievement LLC",
"hub_centerid":"67a830a9-4588-e711-80f6-c4346bacfbbc",
"hub_centertype@OData.Community.Display.V1.FormattedValue":"Center",
"hub_centertype":true,
"_ownerid_value@OData.Community.Display.V1.FormattedValue":"Good Orange Achievement LLC - 04118 - Custom",
"_ownerid_value@Microsoft.Dynamics.CRM.associatednavigationproperty":"ownerid",
"_ownerid_value@Microsoft.Dynamics.CRM.lookuplogicalname":"team",
"_ownerid_value":"22b0f49b-4588-e711-80f6-c4346bacfbbc"
},
{
"@odata.etag":"W/\"4487583\"",
"hub_centername":"Growth Inc",
"hub_centerid":"02a8eb9a-8baa-e711-80fc-c4346badc680",
"hub_centertype@OData.Community.Display.V1.FormattedValue":"Center",
"hub_centertype":true,
"_ownerid_value@OData.Community.Display.V1.FormattedValue":"Nagendra kumar",
"_ownerid_value@Microsoft.Dynamics.CRM.associatednavigationproperty":"ownerid",
"_ownerid_value@Microsoft.Dynamics.CRM.lookuplogicalname":"systemuser",
"_ownerid_value":"c2c4d087-ba0f-e711-80f9-c4346bada738"
},
{
"@odata.etag":"W/\"4487554\"",
"hub_centername":"Hagerstown LC",
"hub_centerid":"6890e22c-7e40-e711-80f0-c4346bacfbbc",
"hub_centertype@OData.Community.Display.V1.FormattedValue":"Center",
"hub_centertype":true,
"_ownerid_value@OData.Community.Display.V1.FormattedValue":"vinod krishnan",
"_ownerid_value@Microsoft.Dynamics.CRM.associatednavigationproperty":"ownerid",
"_ownerid_value@Microsoft.Dynamics.CRM.lookuplogicalname":"systemuser",
"_ownerid_value":"f74f01ad-bc0f-e711-80f9-fc15b42826a0"
},
{
"@odata.etag":"W/\"4487557\"",
"hub_centername":"Holly Springs",
"hub_centerid":"c01eb217-846b-e711-80f2-c4346bacfbbc",
"hub_centertype@OData.Community.Display.V1.FormattedValue":"Satellite",
"hub_centertype":false,
"_ownerid_value@OData.Community.Display.V1.FormattedValue":"Catonsville Learning Center - Custom Team",
"_ownerid_value@Microsoft.Dynamics.CRM.associatednavigationproperty":"ownerid",
"_ownerid_value@Microsoft.Dynamics.CRM.lookuplogicalname":"team",
"_ownerid_value":"7d7cbdd0-8d40-e711-80f0-c4346bad526c",
"_hub_parentcenter_value@OData.Community.Display.V1.FormattedValue":"Catonsville Learning Center",
"_hub_parentcenter_value@Microsoft.Dynamics.CRM.associatednavigationproperty":"hub_ParentCenter",
"_hub_parentcenter_value@Microsoft.Dynamics.CRM.lookuplogicalname":"hub_center",
"_hub_parentcenter_value":"f45b6933-9040-e711-80f0-c4346bad526c"
},
{
"@odata.etag":"W/\"5385497\"",
"hub_centername":"Hunt Valley",
"hub_centerid":"bd2227f2-1a3f-e711-80ef-c4346bad526c",
"hub_centertype@OData.Community.Display.V1.FormattedValue":"Center",
"hub_centertype":true,
"_ownerid_value@OData.Community.Display.V1.FormattedValue":"Anand Subramaniyam",
"_ownerid_value@Microsoft.Dynamics.CRM.associatednavigationproperty":"ownerid",
"_ownerid_value@Microsoft.Dynamics.CRM.lookuplogicalname":"systemuser",
"_ownerid_value":"21eef4e2-c33b-e711-80fe-c4346bada738"
},
{
"@odata.etag":"W/\"4487578\"",
"hub_centername":"IIT",
"hub_centerid":"9f6bee1f-5677-e711-80f4-c4346badc680",
"hub_centertype@OData.Community.Display.V1.FormattedValue":"Satellite",
"hub_centertype":false,
"_ownerid_value@OData.Community.Display.V1.FormattedValue":"Successful Students, LLC - 00117 - Custom",
"_ownerid_value@Microsoft.Dynamics.CRM.associatednavigationproperty":"ownerid",
"_ownerid_value@Microsoft.Dynamics.CRM.lookuplogicalname":"team",
"_ownerid_value":"25195fb8-4f77-e711-80f4-c4346badc680",
"_hub_parentcenter_value@OData.Community.Display.V1.FormattedValue":"Successful Students, LLC",
"_hub_parentcenter_value@Microsoft.Dynamics.CRM.associatednavigationproperty":"hub_ParentCenter",
"_hub_parentcenter_value@Microsoft.Dynamics.CRM.lookuplogicalname":"hub_center",
"_hub_parentcenter_value":"70215cbe-4f77-e711-80f4-c4346badc680"
},
{
"@odata.etag":"W/\"4487580\"",
"hub_centername":"IIT Bhubaneswar",
"hub_centerid":"6b54ab21-fa9a-e711-80f9-c4346badc680",
"hub_centertype@OData.Community.Display.V1.FormattedValue":"Satellite",
"hub_centertype":false,
"_ownerid_value@OData.Community.Display.V1.FormattedValue":"04112 - Nils & Stacia Bollen - Custom",
"_ownerid_value@Microsoft.Dynamics.CRM.associatednavigationproperty":"ownerid",
"_ownerid_value@Microsoft.Dynamics.CRM.lookuplogicalname":"team",
"_ownerid_value":"3acd58ed-c49a-e711-80f8-c4346bad526c",
"_hub_parentcenter_value@OData.Community.Display.V1.FormattedValue":"04112 - Nils & Stacia Bollen",
"_hub_parentcenter_value@Microsoft.Dynamics.CRM.associatednavigationproperty":"hub_ParentCenter",
"_hub_parentcenter_value@Microsoft.Dynamics.CRM.lookuplogicalname":"hub_center",
"_hub_parentcenter_value":"3fcd58ed-c49a-e711-80f8-c4346bad526c"
},
{
"@odata.etag":"W/\"4487548\"",
"hub_centername":"JCP Ascension, LLC",
"hub_centerid":"058d6776-826b-e711-80f2-c4346bac4304",
"hub_centertype@OData.Community.Display.V1.FormattedValue":"Center",
"hub_centertype":true,
"_ownerid_value@OData.Community.Display.V1.FormattedValue":"JCP Ascension, LLC - 00310 - Custom",
"_ownerid_value@Microsoft.Dynamics.CRM.associatednavigationproperty":"ownerid",
"_ownerid_value@Microsoft.Dynamics.CRM.lookuplogicalname":"team",
"_ownerid_value":"d15e394c-826b-e711-80f2-c4346bac4304"
},
{
"@odata.etag":"W/\"4487555\"",
"hub_centername":"Maryland Learning Centers",
"hub_centerid":"14c71086-414c-e711-80f1-c4346bacfbbc",
"hub_centertype@OData.Community.Display.V1.FormattedValue":"Satellite",
"hub_centertype":false,
"_ownerid_value@OData.Community.Display.V1.FormattedValue":"Maryland Learning Centers - 00212 - Custom",
"_ownerid_value@Microsoft.Dynamics.CRM.associatednavigationproperty":"ownerid",
"_ownerid_value@Microsoft.Dynamics.CRM.lookuplogicalname":"team",
"_ownerid_value":"a395e29c-1d4c-e711-80f1-c4346bad526c",
"_hub_parentcenter_value@OData.Community.Display.V1.FormattedValue":"Catonsville Learning Center",
"_hub_parentcenter_value@Microsoft.Dynamics.CRM.associatednavigationproperty":"hub_ParentCenter",
"_hub_parentcenter_value@Microsoft.Dynamics.CRM.lookuplogicalname":"hub_center",
"_hub_parentcenter_value":"f45b6933-9040-e711-80f0-c4346bad526c"
},
{
"@odata.etag":"W/\"4487544\"",
"hub_centername":"NWX",
"hub_centerid":"8112c846-955c-e711-80f1-c4346bac4304",
"hub_centertype@OData.Community.Display.V1.FormattedValue":"Satellite",
"hub_centertype":false,
"_ownerid_value@OData.Community.Display.V1.FormattedValue":"CD5, LLC - 00100 - Custom",
"_ownerid_value@Microsoft.Dynamics.CRM.associatednavigationproperty":"ownerid",
"_ownerid_value@Microsoft.Dynamics.CRM.lookuplogicalname":"team",
"_ownerid_value":"3ab85bde-8b52-e711-80f2-c4346badc680",
"_hub_parentcenter_value@OData.Community.Display.V1.FormattedValue":"CD5, LLC",
"_hub_parentcenter_value@Microsoft.Dynamics.CRM.associatednavigationproperty":"hub_ParentCenter",
"_hub_parentcenter_value@Microsoft.Dynamics.CRM.lookuplogicalname":"hub_center",
"_hub_parentcenter_value":"e9cfb78f-9052-e711-80f1-c4346bad526c"
},
{
"@odata.etag":"W/\"4487568\"",
"hub_centername":"Prod Support Lab",
"hub_centerid":"d3811e7d-2570-e711-80f2-c4346bad526c",
"hub_centertype@OData.Community.Display.V1.FormattedValue":"Center",
"hub_centertype":true,
"_ownerid_value@OData.Community.Display.V1.FormattedValue":"Prod Support Lab - 99990 - Custom",
"_ownerid_value@Microsoft.Dynamics.CRM.associatednavigationproperty":"ownerid",
"_ownerid_value@Microsoft.Dynamics.CRM.lookuplogicalname":"team",
"_ownerid_value":"45b76f6a-2570-e711-80f2-c4346bad526c"
},
{
"@odata.etag":"W/\"4487559\"",
"hub_centername":"Puget Sound Learning Centers, LLC",
"hub_centerid":"20db5a20-f375-e711-80f2-c4346bacfbbc",
"hub_centertype@OData.Community.Display.V1.FormattedValue":"Center",
"hub_centertype":true,
"_ownerid_value@OData.Community.Display.V1.FormattedValue":"Puget Sound Learning Centers, LLC - 00240 - Custom",
"_ownerid_value@Microsoft.Dynamics.CRM.associatednavigationproperty":"ownerid",
"_ownerid_value@Microsoft.Dynamics.CRM.lookuplogicalname":"team",
"_ownerid_value":"91ae2204-f375-e711-80f2-c4346bacfbbc"
},
{
"@odata.etag":"W/\"4487574\"",
"hub_centername":"Ray & Maggie Crawford",
"hub_centerid":"e0a7d0bb-a734-e711-80ee-c4346badc680",
"hub_centertype@OData.Community.Display.V1.FormattedValue":"Center",
"hub_centertype":true,
"_ownerid_value@OData.Community.Display.V1.FormattedValue":"babita khuntia",
"_ownerid_value@Microsoft.Dynamics.CRM.associatednavigationproperty":"ownerid",
"_ownerid_value@Microsoft.Dynamics.CRM.lookuplogicalname":"systemuser",
"_ownerid_value":"50afe85c-ba0f-e711-80e9-c4346bacfb24"
},
{
"@odata.etag":"W/\"4487575\"",
"hub_centername":"SB Education, Inc.",
"hub_centerid":"da8f5a01-116b-e711-80f3-c4346badc680",
"hub_centertype@OData.Community.Display.V1.FormattedValue":"Center",
"hub_centertype":true,
"_ownerid_value@OData.Community.Display.V1.FormattedValue":"SB Education, Inc. - 00211 - Custom",
"_ownerid_value@Microsoft.Dynamics.CRM.associatednavigationproperty":"ownerid",
"_ownerid_value@Microsoft.Dynamics.CRM.lookuplogicalname":"team",
"_ownerid_value":"f986ebd4-106b-e711-80f3-c4346badc680"
},
{
"@odata.etag":"W/\"4487547\"",
"hub_centername":"SBI Education, Inc.",
"hub_centerid":"d12f4168-126b-e711-80f2-c4346bac4304",
"hub_centertype@OData.Community.Display.V1.FormattedValue":"Center",
"hub_centertype":true,
"_ownerid_value@OData.Community.Display.V1.FormattedValue":"SBI Education, Inc. - 00212 - Custom",
"_ownerid_value@Microsoft.Dynamics.CRM.associatednavigationproperty":"ownerid",
"_ownerid_value@Microsoft.Dynamics.CRM.lookuplogicalname":"team",
"_ownerid_value":"0dec935e-126b-e711-80f2-c4346bac4304"
},
{
"@odata.etag":"W/\"4487577\"",
"hub_centername":"Successful Students, LLC",
"hub_centerid":"70215cbe-4f77-e711-80f4-c4346badc680",
"hub_centertype@OData.Community.Display.V1.FormattedValue":"Center",
"hub_centertype":true,
"_ownerid_value@OData.Community.Display.V1.FormattedValue":"Successful Students, LLC - 00117 - Custom",
"_ownerid_value@Microsoft.Dynamics.CRM.associatednavigationproperty":"ownerid",
"_ownerid_value@Microsoft.Dynamics.CRM.lookuplogicalname":"team",
"_ownerid_value":"25195fb8-4f77-e711-80f4-c4346badc680"
},
{
"@odata.etag":"W/\"4487553\"",
"hub_centername":"Timonium Learning Center",
"hub_centerid":"5eb89403-a434-e711-80ed-c4346bacfbbc",
"hub_centertype@OData.Community.Display.V1.FormattedValue":"Center",
"hub_centertype":true,
"_ownerid_value@OData.Community.Display.V1.FormattedValue":"vinod krishnan",
"_ownerid_value@Microsoft.Dynamics.CRM.associatednavigationproperty":"ownerid",
"_ownerid_value@Microsoft.Dynamics.CRM.lookuplogicalname":"systemuser",
"_ownerid_value":"f74f01ad-bc0f-e711-80f9-fc15b42826a0"
},
{
"@odata.etag":"W/\"4487546\"",
"hub_centername":"XYZ Education, Inc.",
"hub_centerid":"912ec9b7-e36a-e711-80f2-c4346bac4304",
"hub_centertype@OData.Community.Display.V1.FormattedValue":"Center",
"hub_centertype":true,
"_ownerid_value@OData.Community.Display.V1.FormattedValue":"XYZ Education, Inc. - 00209 - Custom",
"_ownerid_value@Microsoft.Dynamics.CRM.associatednavigationproperty":"ownerid",
"_ownerid_value@Microsoft.Dynamics.CRM.lookuplogicalname":"team",
"_ownerid_value":"96675d6f-e36a-e711-80f2-c4346bac4304"
}
];

var deliveryType = [
{
"@odata.etag":"W/\"4220124\"",
"hub_name":"Group Facilitation",
"hub_code@OData.Community.Display.V1.FormattedValue":"GF",
"hub_code":2,
"_hub_pricingstructure_value@OData.Community.Display.V1.FormattedValue":"Subscription",
"_hub_pricingstructure_value@Microsoft.Dynamics.CRM.associatednavigationproperty":"hub_pricingstructure",
"_hub_pricingstructure_value@Microsoft.Dynamics.CRM.lookuplogicalname":"hub_pricingstructure",
"_hub_pricingstructure_value":"792f8d35-4e35-e711-80ed-c4346bad526c",
"hub_deliverytypeid":"d6493b3e-4e35-e711-80ed-c4346bad526c"
},
{
"@odata.etag":"W/\"4220122\"",
"hub_name":"Group Instruction",
"hub_code@OData.Community.Display.V1.FormattedValue":"GI",
"hub_code":3,
"_hub_pricingstructure_value@OData.Community.Display.V1.FormattedValue":"Fee Per Course",
"_hub_pricingstructure_value@Microsoft.Dynamics.CRM.associatednavigationproperty":"hub_pricingstructure",
"_hub_pricingstructure_value@Microsoft.Dynamics.CRM.lookuplogicalname":"hub_pricingstructure",
"_hub_pricingstructure_value":"f7b0e613-a534-e711-80ed-c4346bad526c",
"hub_deliverytypeid":"f8b0e613-a534-e711-80ed-c4346bad526c"
},
{
"@odata.etag":"W/\"4220123\"",
"hub_name":"Personal Instruction",
"hub_code@OData.Community.Display.V1.FormattedValue":"PI",
"hub_code":1,
"_hub_pricingstructure_value@OData.Community.Display.V1.FormattedValue":"Per Session",
"_hub_pricingstructure_value@Microsoft.Dynamics.CRM.associatednavigationproperty":"hub_pricingstructure",
"_hub_pricingstructure_value@Microsoft.Dynamics.CRM.lookuplogicalname":"hub_pricingstructure",
"_hub_pricingstructure_value":"d5c706eb-a534-e711-80ed-c4346bad526c",
"hub_deliverytypeid":"d6c706eb-a534-e711-80ed-c4346bad526c"
}
];


var centerAvailable = [
    
    {
      "@odata.etag": "W/\"1482859\"",
      "hub_centername": "Bel Air Learning Center",
      "hub_centerid": "b97bc0df-a334-e711-80ed-c4346bacfbbc",
      "hub_centertype@OData.Community.Display.V1.FormattedValue": "Center",
      "hub_centertype": true
    },
    {
      "@odata.etag": "W/\"1476918\"",
      "hub_centername": "CD5, LLC",
      "hub_centerid": "e9cfb78f-9052-e711-80f1-c4346bad526c",
      "hub_centertype@OData.Community.Display.V1.FormattedValue": "Center",
      "hub_centertype": true
    },
    {
      "@odata.etag": "W/\"1472522\"",
      "hub_centername": "Timonium Learning Center",
      "hub_centerid": "5eb89403-a434-e711-80ed-c4346bacfbbc",
      "hub_centertype@OData.Community.Display.V1.FormattedValue": "Center",
      "hub_centertype": true
    }
];


var time = [
  {
    id:"2h_time",
    name:"2 Hours"
  },
  {
    id:"4h_time",
    name:"4 Hours"
  }
];


var grade = [
{
"1":3,
"2":4,
"3":5,
"4":6,
"5":7,
"6":8,
"7":9,
"8":10,
"9":11,
"10":12,
"11":13,
"12":14,
"PK":1,
"K":2,
"College":15,
"NA":16
}
];

var subject = [
          {
            id:1,
            name:"TUTORING",
            value:"tutoring"
          },
          {
            id:2,
            name:"Math Tutoring",
            value:"math"
          },
          {
            id:3,
            name:"Reading Tutoring",
            value:"reading"
          },
          {
            id:4,
            name:"Writing Tutoring",
            value:"writing"
          },
          {
            id:5,
            name:"Homework Help",
            value:"homeworkhelp"
          },
          {
            id:6,
            name:"Study Skills",
            value:"studyskills"
          },
          {
            id:7,
            name:"EDGE",
            value:"edge"
          },
          {
            id:8,
            name:"Robotics",
            value:"robotics"
          },
          {
            id:9,
            name:"Coding",
            value:"coding"
          },
          {
            id:10,
            name:"Math Edge",
            value:"mathedge"
          },
          {
          
            id:11,
            name:"Engineering",
            value:"engineering"
          },
          {
            id:12,
            name:"Camps",
            value:"camps"
          },
          {
            id:13,
            name:"Science",
            value:"science"
          },
          {
            id:14,
            name:"PREP",
            value:"prep"
          },
          {
            id:15,
            name:"SAT Prep",
            value:"satprep"
          },
          {
            id:16,
            name:"ACT Prep",
            value:"actprep"
          }]; 

var student =  [
{
"@odata.etag":"W/\"5412727\"",
"hub_is_1to1@OData.Community.Display.V1.FormattedValue":"No",
"hub_is_1to1":false,
"_hub_service_value@OData.Community.Display.V1.FormattedValue":"Algebra Fundamentals",
"_hub_service_value@Microsoft.Dynamics.CRM.associatednavigationproperty":"hub_service",
"_hub_service_value@Microsoft.Dynamics.CRM.lookuplogicalname":"hub_productservice",
"_hub_service_value":"de633fde-b4c1-e711-80ff-c4346bac4304",
"hub_isattended@OData.Community.Display.V1.FormattedValue":"No",
"hub_isattended":false,
"_hub_resourceid_value@OData.Community.Display.V1.FormattedValue":"Table-3",
"_hub_resourceid_value@Microsoft.Dynamics.CRM.associatednavigationproperty":"hub_resourceid",
"_hub_resourceid_value@Microsoft.Dynamics.CRM.lookuplogicalname":"hub_center_resources",
"_hub_resourceid_value":"e412b76d-037e-e711-80f4-c4346bad526c",
"hub_session_date@OData.Community.Display.V1.FormattedValue":"12/14/2017",
"hub_session_date":"2017-12-14",
"_hub_center_value@OData.Community.Display.V1.FormattedValue":"Better Education, Inc.",
"_hub_center_value@Microsoft.Dynamics.CRM.associatednavigationproperty":"hub_center",
"_hub_center_value@Microsoft.Dynamics.CRM.lookuplogicalname":"hub_center",
"_hub_center_value":"46ecf508-e26d-e711-80f2-c4346bacfbbc",
"hub_end_time@OData.Community.Display.V1.FormattedValue":"10:15 AM",
"hub_end_time":615,
"_hub_student_value@OData.Community.Display.V1.FormattedValue":"AAdiya K",
"_hub_student_value@Microsoft.Dynamics.CRM.associatednavigationproperty":"hub_student",
"_hub_student_value@Microsoft.Dynamics.CRM.lookuplogicalname":"contact",
"_hub_student_value":"8e8cbec5-53de-e711-8103-c4346bacfbbc",
"hub_sessiontype@OData.Community.Display.V1.FormattedValue":"Regular",
"hub_sessiontype":1,
"hub_name":"AAdiya K - Algebra Fundamentals-9:15 AM-10:15 AM",
"hub_late@OData.Community.Display.V1.FormattedValue":"No",
"hub_late":false,
"hub_start_time@OData.Community.Display.V1.FormattedValue":"9:15 AM",
"hub_start_time":555,
"hub_studentsessionid":"6a4f3635-0ae0-e711-8106-c4346bacfb24",
"_hub_enrollment_value@OData.Community.Display.V1.FormattedValue":"AAdiya K - Algebra Fundamentals",
"_hub_enrollment_value@Microsoft.Dynamics.CRM.associatednavigationproperty":"hub_enrollment",
"_hub_enrollment_value@Microsoft.Dynamics.CRM.lookuplogicalname":"hub_enrollment",
"_hub_enrollment_value":"74ca1cd2-53de-e711-8103-c4346bacfbbc",
"hub_session_status@OData.Community.Display.V1.FormattedValue":"Schedule",
"hub_session_status":1,
"aenrollment_x002e_hub_enrollmentstartdate@OData.Community.Display.V1.FormattedValue":"12/3/2017",
"aenrollment_x002e_hub_enrollmentstartdate":"2017-12-03T00:00:00Z",
"aprogram_x002e_hub_color":"#47D621",
"adeliverytype_x002e_hub_name":"Personal Instruction",
"aenrollment_x002e_hub_name":"AAdiya K - Algebra Fundamentals",
"aproductservice_x002e_hub_deliverytype@OData.Community.Display.V1.FormattedValue":"Personal Instruction",
"aproductservice_x002e_hub_deliverytype":"d6c706eb-a534-e711-80ed-c4346bad526c",
"aenrollment_x002e_hub_enrollmentid":"74ca1cd2-53de-e711-8103-c4346bacfbbc",
"aprogram_x002e_hub_name":"Algebra Fundamentals",
"aprogram_x002e_hub_programid":"f81f8cb0-6d3f-e711-80ef-c4346bad526c",
"aproductservice_x002e_hub_timeslottype@OData.Community.Display.V1.FormattedValue":"Standard",
"aproductservice_x002e_hub_timeslottype":1,
"astudent_x002e_hub_grade@OData.Community.Display.V1.FormattedValue":"6",
"astudent_x002e_hub_grade":8,
"adeliverytype_x002e_hub_code@OData.Community.Display.V1.FormattedValue":"PI",
"adeliverytype_x002e_hub_code":1,
"aproductservice_x002e_hub_duration@OData.Community.Display.V1.FormattedValue":"1 Hour",
"aproductservice_x002e_hub_duration":60
},
{
"@odata.etag":"W/\"5415205\"",
"hub_is_1to1@OData.Community.Display.V1.FormattedValue":"No",
"hub_is_1to1":false,
"_hub_service_value@OData.Community.Display.V1.FormattedValue":"Algebra Fundamentals",
"_hub_service_value@Microsoft.Dynamics.CRM.associatednavigationproperty":"hub_service",
"_hub_service_value@Microsoft.Dynamics.CRM.lookuplogicalname":"hub_productservice",
"_hub_service_value":"de633fde-b4c1-e711-80ff-c4346bac4304",
"hub_isattended@OData.Community.Display.V1.FormattedValue":"No",
"hub_isattended":false,
"_hub_resourceid_value@OData.Community.Display.V1.FormattedValue":"Table-2",
"_hub_resourceid_value@Microsoft.Dynamics.CRM.associatednavigationproperty":"hub_resourceid",
"_hub_resourceid_value@Microsoft.Dynamics.CRM.lookuplogicalname":"hub_center_resources",
"_hub_resourceid_value":"1881f55a-ab77-e711-80f3-c4346bad526c",
"hub_session_date@OData.Community.Display.V1.FormattedValue":"12/14/2017",
"hub_session_date":"2017-12-14",
"_hub_center_value@OData.Community.Display.V1.FormattedValue":"Better Education, Inc.",
"_hub_center_value@Microsoft.Dynamics.CRM.associatednavigationproperty":"hub_center",
"_hub_center_value@Microsoft.Dynamics.CRM.lookuplogicalname":"hub_center",
"_hub_center_value":"46ecf508-e26d-e711-80f2-c4346bacfbbc",
"hub_end_time@OData.Community.Display.V1.FormattedValue":"11:15 AM",
"hub_end_time":675,
"_hub_student_value@OData.Community.Display.V1.FormattedValue":"Aasma K",
"_hub_student_value@Microsoft.Dynamics.CRM.associatednavigationproperty":"hub_student",
"_hub_student_value@Microsoft.Dynamics.CRM.lookuplogicalname":"contact",
"_hub_student_value":"b2049975-fddf-e711-8103-c4346bacfbbc",
"hub_sessiontype@OData.Community.Display.V1.FormattedValue":"Regular",
"hub_sessiontype":1,
"hub_name":"Aasma K - Algebra Fundamentals-10:15 AM-11:15 AM",
"hub_late@OData.Community.Display.V1.FormattedValue":"No",
"hub_late":false,
"hub_start_time@OData.Community.Display.V1.FormattedValue":"10:15 AM",
"hub_start_time":615,
"hub_studentsessionid":"868fafd2-92e0-e711-811d-c4346bada738",
"_hub_enrollment_value@OData.Community.Display.V1.FormattedValue":"Aasma K - Algebra Fundamentals",
"_hub_enrollment_value@Microsoft.Dynamics.CRM.associatednavigationproperty":"hub_enrollment",
"_hub_enrollment_value@Microsoft.Dynamics.CRM.lookuplogicalname":"hub_enrollment",
"_hub_enrollment_value":"af37228a-fddf-e711-8103-c4346bacfbbc",
"hub_session_status@OData.Community.Display.V1.FormattedValue":"Schedule",
"hub_session_status":1,
"aenrollment_x002e_hub_enrollmentstartdate@OData.Community.Display.V1.FormattedValue":"12/3/2017",
"aenrollment_x002e_hub_enrollmentstartdate":"2017-12-03T00:00:00Z",
"aprogram_x002e_hub_color":"#47D621",
"adeliverytype_x002e_hub_name":"Personal Instruction",
"aenrollment_x002e_hub_name":"Aasma K - Algebra Fundamentals",
"aproductservice_x002e_hub_deliverytype@OData.Community.Display.V1.FormattedValue":"Personal Instruction",
"aproductservice_x002e_hub_deliverytype":"d6c706eb-a534-e711-80ed-c4346bad526c",
"aenrollment_x002e_hub_enrollmentid":"af37228a-fddf-e711-8103-c4346bacfbbc",
"aprogram_x002e_hub_name":"Algebra Fundamentals",
"aprogram_x002e_hub_programid":"f81f8cb0-6d3f-e711-80ef-c4346bad526c",
"aproductservice_x002e_hub_timeslottype@OData.Community.Display.V1.FormattedValue":"Standard",
"aproductservice_x002e_hub_timeslottype":1,
"astudent_x002e_hub_grade@OData.Community.Display.V1.FormattedValue":"7",
"astudent_x002e_hub_grade":9,
"adeliverytype_x002e_hub_code@OData.Community.Display.V1.FormattedValue":"PI",
"adeliverytype_x002e_hub_code":1,
"aproductservice_x002e_hub_duration@OData.Community.Display.V1.FormattedValue":"1 Hour",
"aproductservice_x002e_hub_duration":60
},
{
"@odata.etag":"W/\"5415242\"",
"hub_is_1to1@OData.Community.Display.V1.FormattedValue":"No",
"hub_is_1to1":false,
"_hub_service_value@OData.Community.Display.V1.FormattedValue":"Algebra Fundamentals",
"_hub_service_value@Microsoft.Dynamics.CRM.associatednavigationproperty":"hub_service",
"_hub_service_value@Microsoft.Dynamics.CRM.lookuplogicalname":"hub_productservice",
"_hub_service_value":"de633fde-b4c1-e711-80ff-c4346bac4304",
"hub_isattended@OData.Community.Display.V1.FormattedValue":"No",
"hub_isattended":false,
"_hub_resourceid_value@OData.Community.Display.V1.FormattedValue":"Table-2",
"_hub_resourceid_value@Microsoft.Dynamics.CRM.associatednavigationproperty":"hub_resourceid",
"_hub_resourceid_value@Microsoft.Dynamics.CRM.lookuplogicalname":"hub_center_resources",
"_hub_resourceid_value":"1881f55a-ab77-e711-80f3-c4346bad526c",
"hub_session_date@OData.Community.Display.V1.FormattedValue":"12/14/2017",
"hub_session_date":"2017-12-14",
"_hub_center_value@OData.Community.Display.V1.FormattedValue":"Better Education, Inc.",
"_hub_center_value@Microsoft.Dynamics.CRM.associatednavigationproperty":"hub_center",
"_hub_center_value@Microsoft.Dynamics.CRM.lookuplogicalname":"hub_center",
"_hub_center_value":"46ecf508-e26d-e711-80f2-c4346bacfbbc",
"hub_end_time@OData.Community.Display.V1.FormattedValue":"1:15 PM",
"hub_end_time":795,
"_hub_student_value@OData.Community.Display.V1.FormattedValue":"Aasma K",
"_hub_student_value@Microsoft.Dynamics.CRM.associatednavigationproperty":"hub_student",
"_hub_student_value@Microsoft.Dynamics.CRM.lookuplogicalname":"contact",
"_hub_student_value":"b2049975-fddf-e711-8103-c4346bacfbbc",
"hub_sessiontype@OData.Community.Display.V1.FormattedValue":"Regular",
"hub_sessiontype":1,
"hub_name":"Aasma K - Algebra Fundamentals-12:15 PM-1:15 PM",
"hub_late@OData.Community.Display.V1.FormattedValue":"No",
"hub_late":false,
"hub_start_time@OData.Community.Display.V1.FormattedValue":"12:15 PM",
"hub_start_time":735,
"hub_studentsessionid":"1f86f314-93e0-e711-811d-c4346bada738",
"_hub_enrollment_value@OData.Community.Display.V1.FormattedValue":"Aasma K - Algebra Fundamentals",
"_hub_enrollment_value@Microsoft.Dynamics.CRM.associatednavigationproperty":"hub_enrollment",
"_hub_enrollment_value@Microsoft.Dynamics.CRM.lookuplogicalname":"hub_enrollment",
"_hub_enrollment_value":"af37228a-fddf-e711-8103-c4346bacfbbc",
"hub_session_status@OData.Community.Display.V1.FormattedValue":"Schedule",
"hub_session_status":1,
"aenrollment_x002e_hub_enrollmentstartdate@OData.Community.Display.V1.FormattedValue":"12/3/2017",
"aenrollment_x002e_hub_enrollmentstartdate":"2017-12-03T00:00:00Z",
"aprogram_x002e_hub_color":"#47D621",
"adeliverytype_x002e_hub_name":"Personal Instruction",
"aenrollment_x002e_hub_name":"Aasma K - Algebra Fundamentals",
"aproductservice_x002e_hub_deliverytype@OData.Community.Display.V1.FormattedValue":"Personal Instruction",
"aproductservice_x002e_hub_deliverytype":"d6c706eb-a534-e711-80ed-c4346bad526c",
"aenrollment_x002e_hub_enrollmentid":"af37228a-fddf-e711-8103-c4346bacfbbc",
"aprogram_x002e_hub_name":"Algebra Fundamentals",
"aprogram_x002e_hub_programid":"f81f8cb0-6d3f-e711-80ef-c4346bad526c",
"aproductservice_x002e_hub_timeslottype@OData.Community.Display.V1.FormattedValue":"Standard",
"aproductservice_x002e_hub_timeslottype":1,
"astudent_x002e_hub_grade@OData.Community.Display.V1.FormattedValue":"7",
"astudent_x002e_hub_grade":9,
"adeliverytype_x002e_hub_code@OData.Community.Display.V1.FormattedValue":"PI",
"adeliverytype_x002e_hub_code":1,
"aproductservice_x002e_hub_duration@OData.Community.Display.V1.FormattedValue":"1 Hour",
"aproductservice_x002e_hub_duration":60
},
{
"@odata.etag":"W/\"5415243\"",
"hub_is_1to1@OData.Community.Display.V1.FormattedValue":"No",
"hub_is_1to1":false,
"_hub_service_value@OData.Community.Display.V1.FormattedValue":"Algebra Fundamentals",
"_hub_service_value@Microsoft.Dynamics.CRM.associatednavigationproperty":"hub_service",
"_hub_service_value@Microsoft.Dynamics.CRM.lookuplogicalname":"hub_productservice",
"_hub_service_value":"de633fde-b4c1-e711-80ff-c4346bac4304",
"hub_isattended@OData.Community.Display.V1.FormattedValue":"No",
"hub_isattended":false,
"_hub_resourceid_value@OData.Community.Display.V1.FormattedValue":"Table-2",
"_hub_resourceid_value@Microsoft.Dynamics.CRM.associatednavigationproperty":"hub_resourceid",
"_hub_resourceid_value@Microsoft.Dynamics.CRM.lookuplogicalname":"hub_center_resources",
"_hub_resourceid_value":"1881f55a-ab77-e711-80f3-c4346bad526c",
"hub_session_date@OData.Community.Display.V1.FormattedValue":"12/14/2017",
"hub_session_date":"2017-12-14",
"_hub_center_value@OData.Community.Display.V1.FormattedValue":"Better Education, Inc.",
"_hub_center_value@Microsoft.Dynamics.CRM.associatednavigationproperty":"hub_center",
"_hub_center_value@Microsoft.Dynamics.CRM.lookuplogicalname":"hub_center",
"_hub_center_value":"46ecf508-e26d-e711-80f2-c4346bacfbbc",
"hub_end_time@OData.Community.Display.V1.FormattedValue":"12:15 PM",
"hub_end_time":735,
"_hub_student_value@OData.Community.Display.V1.FormattedValue":"Aasma K",
"_hub_student_value@Microsoft.Dynamics.CRM.associatednavigationproperty":"hub_student",
"_hub_student_value@Microsoft.Dynamics.CRM.lookuplogicalname":"contact",
"_hub_student_value":"b2049975-fddf-e711-8103-c4346bacfbbc",
"hub_sessiontype@OData.Community.Display.V1.FormattedValue":"Regular",
"hub_sessiontype":1,
"hub_name":"Aasma K - Algebra Fundamentals-11:15 AM-12:15 PM",
"hub_late@OData.Community.Display.V1.FormattedValue":"No",
"hub_late":false,
"hub_start_time@OData.Community.Display.V1.FormattedValue":"11:15 AM",
"hub_start_time":675,
"hub_studentsessionid":"2086f314-93e0-e711-811d-c4346bada738",
"_hub_enrollment_value@OData.Community.Display.V1.FormattedValue":"Aasma K - Algebra Fundamentals",
"_hub_enrollment_value@Microsoft.Dynamics.CRM.associatednavigationproperty":"hub_enrollment",
"_hub_enrollment_value@Microsoft.Dynamics.CRM.lookuplogicalname":"hub_enrollment",
"_hub_enrollment_value":"af37228a-fddf-e711-8103-c4346bacfbbc",
"hub_session_status@OData.Community.Display.V1.FormattedValue":"Schedule",
"hub_session_status":1,
"aenrollment_x002e_hub_enrollmentstartdate@OData.Community.Display.V1.FormattedValue":"12/3/2017",
"aenrollment_x002e_hub_enrollmentstartdate":"2017-12-03T00:00:00Z",
"aprogram_x002e_hub_color":"#47D621",
"adeliverytype_x002e_hub_name":"Personal Instruction",
"aenrollment_x002e_hub_name":"Aasma K - Algebra Fundamentals",
"aproductservice_x002e_hub_deliverytype@OData.Community.Display.V1.FormattedValue":"Personal Instruction",
"aproductservice_x002e_hub_deliverytype":"d6c706eb-a534-e711-80ed-c4346bad526c",
"aenrollment_x002e_hub_enrollmentid":"af37228a-fddf-e711-8103-c4346bacfbbc",
"aprogram_x002e_hub_name":"Algebra Fundamentals",
"aprogram_x002e_hub_programid":"f81f8cb0-6d3f-e711-80ef-c4346bad526c",
"aproductservice_x002e_hub_timeslottype@OData.Community.Display.V1.FormattedValue":"Standard",
"aproductservice_x002e_hub_timeslottype":1,
"astudent_x002e_hub_grade@OData.Community.Display.V1.FormattedValue":"7",
"astudent_x002e_hub_grade":9,
"adeliverytype_x002e_hub_code@OData.Community.Display.V1.FormattedValue":"PI",
"adeliverytype_x002e_hub_code":1,
"aproductservice_x002e_hub_duration@OData.Community.Display.V1.FormattedValue":"1 Hour",
"aproductservice_x002e_hub_duration":60
},
{
"@odata.etag":"W/\"5415179\"",
"hub_is_1to1@OData.Community.Display.V1.FormattedValue":"No",
"hub_is_1to1":false,
"_hub_service_value@OData.Community.Display.V1.FormattedValue":"Algebra Fundamentals",
"_hub_service_value@Microsoft.Dynamics.CRM.associatednavigationproperty":"hub_service",
"_hub_service_value@Microsoft.Dynamics.CRM.lookuplogicalname":"hub_productservice",
"_hub_service_value":"de633fde-b4c1-e711-80ff-c4346bac4304",
"hub_isattended@OData.Community.Display.V1.FormattedValue":"No",
"hub_isattended":false,
"_hub_resourceid_value@OData.Community.Display.V1.FormattedValue":"Table-3",
"_hub_resourceid_value@Microsoft.Dynamics.CRM.associatednavigationproperty":"hub_resourceid",
"_hub_resourceid_value@Microsoft.Dynamics.CRM.lookuplogicalname":"hub_center_resources",
"_hub_resourceid_value":"e412b76d-037e-e711-80f4-c4346bad526c",
"hub_session_date@OData.Community.Display.V1.FormattedValue":"12/14/2017",
"hub_session_date":"2017-12-14",
"_hub_center_value@OData.Community.Display.V1.FormattedValue":"Better Education, Inc.",
"_hub_center_value@Microsoft.Dynamics.CRM.associatednavigationproperty":"hub_center",
"_hub_center_value@Microsoft.Dynamics.CRM.lookuplogicalname":"hub_center",
"_hub_center_value":"46ecf508-e26d-e711-80f2-c4346bacfbbc",
"hub_end_time@OData.Community.Display.V1.FormattedValue":"10:15 AM",
"hub_end_time":615,
"_hub_student_value@OData.Community.Display.V1.FormattedValue":"Aasma K",
"_hub_student_value@Microsoft.Dynamics.CRM.associatednavigationproperty":"hub_student",
"_hub_student_value@Microsoft.Dynamics.CRM.lookuplogicalname":"contact",
"_hub_student_value":"b2049975-fddf-e711-8103-c4346bacfbbc",
"hub_sessiontype@OData.Community.Display.V1.FormattedValue":"Regular",
"hub_sessiontype":1,
"hub_name":"Aasma K - Algebra Fundamentals-9:15 AM-10:15 AM",
"hub_late@OData.Community.Display.V1.FormattedValue":"No",
"hub_late":false,
"hub_start_time@OData.Community.Display.V1.FormattedValue":"9:15 AM",
"hub_start_time":555,
"hub_studentsessionid":"a42eadc3-92e0-e711-8118-fc15b42826a0",
"_hub_enrollment_value@OData.Community.Display.V1.FormattedValue":"Aasma K - Algebra Fundamentals",
"_hub_enrollment_value@Microsoft.Dynamics.CRM.associatednavigationproperty":"hub_enrollment",
"_hub_enrollment_value@Microsoft.Dynamics.CRM.lookuplogicalname":"hub_enrollment",
"_hub_enrollment_value":"af37228a-fddf-e711-8103-c4346bacfbbc",
"hub_session_status@OData.Community.Display.V1.FormattedValue":"Schedule",
"hub_session_status":1,
"aenrollment_x002e_hub_enrollmentstartdate@OData.Community.Display.V1.FormattedValue":"12/3/2017",
"aenrollment_x002e_hub_enrollmentstartdate":"2017-12-03T00:00:00Z",
"aprogram_x002e_hub_color":"#47D621",
"adeliverytype_x002e_hub_name":"Personal Instruction",
"aenrollment_x002e_hub_name":"Aasma K - Algebra Fundamentals",
"aproductservice_x002e_hub_deliverytype@OData.Community.Display.V1.FormattedValue":"Personal Instruction",
"aproductservice_x002e_hub_deliverytype":"d6c706eb-a534-e711-80ed-c4346bad526c",
"aenrollment_x002e_hub_enrollmentid":"af37228a-fddf-e711-8103-c4346bacfbbc",
"aprogram_x002e_hub_name":"Algebra Fundamentals",
"aprogram_x002e_hub_programid":"f81f8cb0-6d3f-e711-80ef-c4346bad526c",
"aproductservice_x002e_hub_timeslottype@OData.Community.Display.V1.FormattedValue":"Standard",
"aproductservice_x002e_hub_timeslottype":1,
"astudent_x002e_hub_grade@OData.Community.Display.V1.FormattedValue":"7",
"astudent_x002e_hub_grade":9,
"adeliverytype_x002e_hub_code@OData.Community.Display.V1.FormattedValue":"PI",
"adeliverytype_x002e_hub_code":1,
"aproductservice_x002e_hub_duration@OData.Community.Display.V1.FormattedValue":"1 Hour",
"aproductservice_x002e_hub_duration":60
},
{
"@odata.etag":"W/\"5293685\"",
"hub_is_1to1@OData.Community.Display.V1.FormattedValue":"No",
"hub_is_1to1":false,
"_hub_service_value@OData.Community.Display.V1.FormattedValue":"Algebra Fundamentals",
"_hub_service_value@Microsoft.Dynamics.CRM.associatednavigationproperty":"hub_service",
"_hub_service_value@Microsoft.Dynamics.CRM.lookuplogicalname":"hub_productservice",
"_hub_service_value":"de633fde-b4c1-e711-80ff-c4346bac4304",
"hub_isattended@OData.Community.Display.V1.FormattedValue":"No",
"hub_isattended":false,
"_hub_resourceid_value@OData.Community.Display.V1.FormattedValue":"Table-3",
"_hub_resourceid_value@Microsoft.Dynamics.CRM.associatednavigationproperty":"hub_resourceid",
"_hub_resourceid_value@Microsoft.Dynamics.CRM.lookuplogicalname":"hub_center_resources",
"_hub_resourceid_value":"e412b76d-037e-e711-80f4-c4346bad526c",
"hub_session_date@OData.Community.Display.V1.FormattedValue":"12/14/2017",
"hub_session_date":"2017-12-14",
"_hub_center_value@OData.Community.Display.V1.FormattedValue":"Better Education, Inc.",
"_hub_center_value@Microsoft.Dynamics.CRM.associatednavigationproperty":"hub_center",
"_hub_center_value@Microsoft.Dynamics.CRM.lookuplogicalname":"hub_center",
"_hub_center_value":"46ecf508-e26d-e711-80f2-c4346bacfbbc",
"hub_end_time@OData.Community.Display.V1.FormattedValue":"10:00 AM",
"hub_end_time":600,
"_hub_student_value@OData.Community.Display.V1.FormattedValue":"Ayesha Dias",
"_hub_student_value@Microsoft.Dynamics.CRM.associatednavigationproperty":"hub_student",
"_hub_student_value@Microsoft.Dynamics.CRM.lookuplogicalname":"contact",
"_hub_student_value":"84c07bd9-0dca-e711-80ff-c4346bac4304",
"hub_sessiontype@OData.Community.Display.V1.FormattedValue":"Regular",
"hub_sessiontype":1,
"hub_name":"Ayesha Dias - Algebra Fundamentals-9:00 AM-10:00 AM",
"hub_late@OData.Community.Display.V1.FormattedValue":"No",
"hub_late":false,
"hub_start_time@OData.Community.Display.V1.FormattedValue":"9:00 AM",
"hub_start_time":540,
"hub_studentsessionid":"3f1a5a85-10ca-e711-811a-c4346bada738",
"_hub_enrollment_value@OData.Community.Display.V1.FormattedValue":"Ayesha Dias - Algebra Fundamentals",
"_hub_enrollment_value@Microsoft.Dynamics.CRM.associatednavigationproperty":"hub_enrollment",
"_hub_enrollment_value@Microsoft.Dynamics.CRM.lookuplogicalname":"hub_enrollment",
"_hub_enrollment_value":"6f2b4d4a-10ca-e711-80ff-c4346bac4304",
"hub_session_status@OData.Community.Display.V1.FormattedValue":"Schedule",
"hub_session_status":1,
"aenrollment_x002e_hub_enrollmentstartdate@OData.Community.Display.V1.FormattedValue":"11/1/2017",
"aenrollment_x002e_hub_enrollmentstartdate":"2017-11-01T00:00:00Z",
"aprogram_x002e_hub_color":"#47D621",
"adeliverytype_x002e_hub_name":"Personal Instruction",
"aenrollment_x002e_hub_name":"Ayesha Dias - Algebra Fundamentals",
"aprogram_x002e_hub_programid":"f81f8cb0-6d3f-e711-80ef-c4346bad526c",
"aenrollment_x002e_hub_enrollmentenddate@OData.Community.Display.V1.FormattedValue":"1/4/2018",
"aenrollment_x002e_hub_enrollmentenddate":"2018-01-04T00:00:00Z",
"aproductservice_x002e_hub_deliverytype@OData.Community.Display.V1.FormattedValue":"Personal Instruction",
"aproductservice_x002e_hub_deliverytype":"d6c706eb-a534-e711-80ed-c4346bad526c",
"aenrollment_x002e_hub_enrollmentid":"6f2b4d4a-10ca-e711-80ff-c4346bac4304",
"aprogram_x002e_hub_name":"Algebra Fundamentals",
"aproductservice_x002e_hub_timeslottype@OData.Community.Display.V1.FormattedValue":"Standard",
"aproductservice_x002e_hub_timeslottype":1,
"astudent_x002e_hub_grade@OData.Community.Display.V1.FormattedValue":"6",
"astudent_x002e_hub_grade":8,
"adeliverytype_x002e_hub_code@OData.Community.Display.V1.FormattedValue":"PI",
"adeliverytype_x002e_hub_code":1,
"aproductservice_x002e_hub_duration@OData.Community.Display.V1.FormattedValue":"1 Hour",
"aproductservice_x002e_hub_duration":60
},
{
"@odata.etag":"W/\"4583964\"",
"hub_is_1to1@OData.Community.Display.V1.FormattedValue":"No",
"hub_is_1to1":false,
"_hub_service_value@OData.Community.Display.V1.FormattedValue":"Homework Help for winter",
"_hub_service_value@Microsoft.Dynamics.CRM.associatednavigationproperty":"hub_service",
"_hub_service_value@Microsoft.Dynamics.CRM.lookuplogicalname":"hub_productservice",
"_hub_service_value":"df4d6b65-5da8-e711-80f9-c4346bad526c",
"hub_isattended@OData.Community.Display.V1.FormattedValue":"No",
"hub_isattended":false,
"_hub_resourceid_value@OData.Community.Display.V1.FormattedValue":"Table-2",
"_hub_resourceid_value@Microsoft.Dynamics.CRM.associatednavigationproperty":"hub_resourceid",
"_hub_resourceid_value@Microsoft.Dynamics.CRM.lookuplogicalname":"hub_center_resources",
"_hub_resourceid_value":"1881f55a-ab77-e711-80f3-c4346bad526c",
"hub_session_date@OData.Community.Display.V1.FormattedValue":"12/14/2017",
"hub_session_date":"2017-12-14",
"_hub_center_value@OData.Community.Display.V1.FormattedValue":"Better Education, Inc.",
"_hub_center_value@Microsoft.Dynamics.CRM.associatednavigationproperty":"hub_center",
"_hub_center_value@Microsoft.Dynamics.CRM.lookuplogicalname":"hub_center",
"_hub_center_value":"46ecf508-e26d-e711-80f2-c4346bacfbbc",
"hub_end_time@OData.Community.Display.V1.FormattedValue":"10:30 AM",
"hub_end_time":630,
"_hub_student_value@OData.Community.Display.V1.FormattedValue":"Charul Robert",
"_hub_student_value@Microsoft.Dynamics.CRM.associatednavigationproperty":"hub_student",
"_hub_student_value@Microsoft.Dynamics.CRM.lookuplogicalname":"contact",
"_hub_student_value":"ac89b9d7-5bab-e711-80fb-c4346bad526c",
"hub_sessiontype@OData.Community.Display.V1.FormattedValue":"Regular",
"hub_sessiontype":1,
"hub_name":"Charul Robert - Homework Help for winter - 9:30 AM - 10:30 AM",
"hub_late@OData.Community.Display.V1.FormattedValue":"No",
"hub_late":false,
"hub_start_time@OData.Community.Display.V1.FormattedValue":"9:30 AM",
"hub_start_time":570,
"hub_studentsessionid":"e86edc59-5bc3-e711-80ff-c4346bac4304",
"_hub_enrollment_value@OData.Community.Display.V1.FormattedValue":"Charul Robert - Homework Help for winter",
"_hub_enrollment_value@Microsoft.Dynamics.CRM.associatednavigationproperty":"hub_enrollment",
"_hub_enrollment_value@Microsoft.Dynamics.CRM.lookuplogicalname":"hub_enrollment",
"_hub_enrollment_value":"470595f0-5bab-e711-80fb-c4346bad526c",
"hub_session_status@OData.Community.Display.V1.FormattedValue":"Schedule",
"hub_session_status":1,
"aenrollment_x002e_hub_enrollmentstartdate@OData.Community.Display.V1.FormattedValue":"10/7/2017",
"aenrollment_x002e_hub_enrollmentstartdate":"2017-10-07T00:00:00Z",
"aprogram_x002e_hub_color":"#21ADD6",
"adeliverytype_x002e_hub_name":"Personal Instruction",
"aenrollment_x002e_hub_name":"Charul Robert - Homework Help for winter",
"aproductservice_x002e_hub_deliverytype@OData.Community.Display.V1.FormattedValue":"Personal Instruction",
"aproductservice_x002e_hub_deliverytype":"d6c706eb-a534-e711-80ed-c4346bad526c",
"aenrollment_x002e_hub_enrollmentid":"470595f0-5bab-e711-80fb-c4346bad526c",
"aprogram_x002e_hub_name":"Homework Help",
"aprogram_x002e_hub_programid":"3456264c-bd3c-e711-80ef-c4346bac4304",
"aproductservice_x002e_hub_timeslottype@OData.Community.Display.V1.FormattedValue":"Standard",
"aproductservice_x002e_hub_timeslottype":1,
"astudent_x002e_hub_grade@OData.Community.Display.V1.FormattedValue":"1",
"astudent_x002e_hub_grade":3,
"adeliverytype_x002e_hub_code@OData.Community.Display.V1.FormattedValue":"PI",
"adeliverytype_x002e_hub_code":1,
"aproductservice_x002e_hub_duration@OData.Community.Display.V1.FormattedValue":"1 Hour",
"aproductservice_x002e_hub_duration":60
},
{
"@odata.etag":"W/\"5134562\"",
"hub_is_1to1@OData.Community.Display.V1.FormattedValue":"No",
"hub_is_1to1":false,
"_hub_service_value@OData.Community.Display.V1.FormattedValue":"College Prep Writing",
"_hub_service_value@Microsoft.Dynamics.CRM.associatednavigationproperty":"hub_service",
"_hub_service_value@Microsoft.Dynamics.CRM.lookuplogicalname":"hub_productservice",
"_hub_service_value":"bc750376-c3c1-e711-80ff-c4346bad526c",
"hub_isattended@OData.Community.Display.V1.FormattedValue":"No",
"hub_isattended":false,
"_hub_resourceid_value@OData.Community.Display.V1.FormattedValue":"Table-3",
"_hub_resourceid_value@Microsoft.Dynamics.CRM.associatednavigationproperty":"hub_resourceid",
"_hub_resourceid_value@Microsoft.Dynamics.CRM.lookuplogicalname":"hub_center_resources",
"_hub_resourceid_value":"e412b76d-037e-e711-80f4-c4346bad526c",
"hub_session_date@OData.Community.Display.V1.FormattedValue":"12/14/2017",
"hub_session_date":"2017-12-14",
"_hub_center_value@OData.Community.Display.V1.FormattedValue":"Better Education, Inc.",
"_hub_center_value@Microsoft.Dynamics.CRM.associatednavigationproperty":"hub_center",
"_hub_center_value@Microsoft.Dynamics.CRM.lookuplogicalname":"hub_center",
"_hub_center_value":"46ecf508-e26d-e711-80f2-c4346bacfbbc",
"hub_end_time@OData.Community.Display.V1.FormattedValue":"7:00 PM",
"hub_end_time":1140,
"_hub_student_value@OData.Community.Display.V1.FormattedValue":"Dr Watson S",
"_hub_student_value@Microsoft.Dynamics.CRM.associatednavigationproperty":"hub_student",
"_hub_student_value@Microsoft.Dynamics.CRM.lookuplogicalname":"contact",
"_hub_student_value":"0623e2c2-7ec8-e711-80ff-c4346bac4304",
"hub_sessiontype@OData.Community.Display.V1.FormattedValue":"Regular",
"hub_sessiontype":1,
"hub_name":"Dr Watson S - College Prep Writing-5:30 PM-7:00 PM",
"hub_late@OData.Community.Display.V1.FormattedValue":"No",
"hub_late":false,
"hub_start_time@OData.Community.Display.V1.FormattedValue":"5:30 PM",
"hub_start_time":1050,
"hub_studentsessionid":"5d11fe25-03c9-e711-8113-c4346bad36fc",
"_hub_enrollment_value@OData.Community.Display.V1.FormattedValue":"Dr Watson S - College Prep Writing",
"_hub_enrollment_value@Microsoft.Dynamics.CRM.associatednavigationproperty":"hub_enrollment",
"_hub_enrollment_value@Microsoft.Dynamics.CRM.lookuplogicalname":"hub_enrollment",
"_hub_enrollment_value":"2ec0bfbd-02c9-e711-80ff-c4346bac4304",
"hub_session_status@OData.Community.Display.V1.FormattedValue":"Schedule",
"hub_session_status":1,
"aenrollment_x002e_hub_enrollmentstartdate@OData.Community.Display.V1.FormattedValue":"11/14/2017",
"aenrollment_x002e_hub_enrollmentstartdate":"2017-11-14T00:00:00Z",
"aprogram_x002e_hub_color":"#C8D621",
"adeliverytype_x002e_hub_name":"Personal Instruction",
"aenrollment_x002e_hub_name":"Dr Watson S - College Prep Writing",
"aproductservice_x002e_hub_deliverytype@OData.Community.Display.V1.FormattedValue":"Personal Instruction",
"aproductservice_x002e_hub_deliverytype":"d6c706eb-a534-e711-80ed-c4346bad526c",
"aenrollment_x002e_hub_enrollmentid":"2ec0bfbd-02c9-e711-80ff-c4346bac4304",
"aprogram_x002e_hub_name":"College Prep Writing: English 101",
"aprogram_x002e_hub_programid":"86d15aca-a534-e711-80ed-c4346bad526c",
"aproductservice_x002e_hub_timeslottype@OData.Community.Display.V1.FormattedValue":"Standard",
"aproductservice_x002e_hub_timeslottype":1,
"astudent_x002e_hub_grade@OData.Community.Display.V1.FormattedValue":"7",
"astudent_x002e_hub_grade":9,
"adeliverytype_x002e_hub_code@OData.Community.Display.V1.FormattedValue":"PI",
"adeliverytype_x002e_hub_code":1,
"aproductservice_x002e_hub_duration@OData.Community.Display.V1.FormattedValue":"1 Hour",
"aproductservice_x002e_hub_duration":60
},
{
"@odata.etag":"W/\"5207555\"",
"hub_is_1to1@OData.Community.Display.V1.FormattedValue":"No",
"hub_is_1to1":false,
"_hub_service_value@OData.Community.Display.V1.FormattedValue":"College Prep Writing",
"_hub_service_value@Microsoft.Dynamics.CRM.associatednavigationproperty":"hub_service",
"_hub_service_value@Microsoft.Dynamics.CRM.lookuplogicalname":"hub_productservice",
"_hub_service_value":"bc750376-c3c1-e711-80ff-c4346bad526c",
"hub_isattended@OData.Community.Display.V1.FormattedValue":"No",
"hub_isattended":false,
"_hub_resourceid_value@OData.Community.Display.V1.FormattedValue":"Table-2",
"_hub_resourceid_value@Microsoft.Dynamics.CRM.associatednavigationproperty":"hub_resourceid",
"_hub_resourceid_value@Microsoft.Dynamics.CRM.lookuplogicalname":"hub_center_resources",
"_hub_resourceid_value":"1881f55a-ab77-e711-80f3-c4346bad526c",
"hub_session_date@OData.Community.Display.V1.FormattedValue":"12/14/2017",
"hub_session_date":"2017-12-14",
"_hub_center_value@OData.Community.Display.V1.FormattedValue":"Better Education, Inc.",
"_hub_center_value@Microsoft.Dynamics.CRM.associatednavigationproperty":"hub_center",
"_hub_center_value@Microsoft.Dynamics.CRM.lookuplogicalname":"hub_center",
"_hub_center_value":"46ecf508-e26d-e711-80f2-c4346bacfbbc",
"hub_end_time@OData.Community.Display.V1.FormattedValue":"7:00 PM",
"hub_end_time":1140,
"_hub_student_value@OData.Community.Display.V1.FormattedValue":"Gladwin Samuel",
"_hub_student_value@Microsoft.Dynamics.CRM.associatednavigationproperty":"hub_student",
"_hub_student_value@Microsoft.Dynamics.CRM.lookuplogicalname":"contact",
"_hub_student_value":"8bc725b6-3ac6-e711-80ff-c4346bac4304",
"hub_sessiontype@OData.Community.Display.V1.FormattedValue":"Regular",
"hub_sessiontype":1,
"hub_name":"Gladwin Samuel - College Prep Writing-5:30 PM-7:00 PM",
"hub_late@OData.Community.Display.V1.FormattedValue":"No",
"hub_late":false,
"hub_start_time@OData.Community.Display.V1.FormattedValue":"5:30 PM",
"hub_start_time":1050,
"hub_studentsessionid":"ac3dd8b9-a4ce-e711-8104-c4346bacfb24",
"_hub_enrollment_value@OData.Community.Display.V1.FormattedValue":"Gladwin Samuel - College Prep Writing",
"_hub_enrollment_value@Microsoft.Dynamics.CRM.associatednavigationproperty":"hub_enrollment",
"_hub_enrollment_value@Microsoft.Dynamics.CRM.lookuplogicalname":"hub_enrollment",
"_hub_enrollment_value":"e72b76a7-a4ce-e711-8100-c4346bad526c",
"hub_session_status@OData.Community.Display.V1.FormattedValue":"Schedule",
"hub_session_status":1,
"aenrollment_x002e_hub_enrollmentstartdate@OData.Community.Display.V1.FormattedValue":"11/19/2017",
"aenrollment_x002e_hub_enrollmentstartdate":"2017-11-19T00:00:00Z",
"aprogram_x002e_hub_color":"#C8D621",
"adeliverytype_x002e_hub_name":"Personal Instruction",
"aenrollment_x002e_hub_name":"Gladwin Samuel - College Prep Writing",
"aproductservice_x002e_hub_deliverytype@OData.Community.Display.V1.FormattedValue":"Personal Instruction",
"aproductservice_x002e_hub_deliverytype":"d6c706eb-a534-e711-80ed-c4346bad526c",
"aenrollment_x002e_hub_enrollmentid":"e72b76a7-a4ce-e711-8100-c4346bad526c",
"aprogram_x002e_hub_name":"College Prep Writing: English 101",
"aprogram_x002e_hub_programid":"86d15aca-a534-e711-80ed-c4346bad526c",
"aproductservice_x002e_hub_timeslottype@OData.Community.Display.V1.FormattedValue":"Standard",
"aproductservice_x002e_hub_timeslottype":1,
"astudent_x002e_hub_grade@OData.Community.Display.V1.FormattedValue":"7",
"astudent_x002e_hub_grade":9,
"adeliverytype_x002e_hub_code@OData.Community.Display.V1.FormattedValue":"PI",
"adeliverytype_x002e_hub_code":1,
"aproductservice_x002e_hub_duration@OData.Community.Display.V1.FormattedValue":"1 Hour",
"aproductservice_x002e_hub_duration":60
},
{
"@odata.etag":"W/\"4583965\"",
"hub_is_1to1@OData.Community.Display.V1.FormattedValue":"No",
"hub_is_1to1":false,
"_hub_service_value@OData.Community.Display.V1.FormattedValue":"Bot Builders 101 for Girls",
"_hub_service_value@Microsoft.Dynamics.CRM.associatednavigationproperty":"hub_service",
"_hub_service_value@Microsoft.Dynamics.CRM.lookuplogicalname":"hub_productservice",
"_hub_service_value":"49b74d1e-9c97-e711-80f9-c4346badc680",
"hub_isattended@OData.Community.Display.V1.FormattedValue":"No",
"hub_isattended":false,
"hub_session_date@OData.Community.Display.V1.FormattedValue":"12/14/2017",
"hub_session_date":"2017-12-14",
"_hub_center_value@OData.Community.Display.V1.FormattedValue":"Better Education, Inc.",
"_hub_center_value@Microsoft.Dynamics.CRM.associatednavigationproperty":"hub_center",
"_hub_center_value@Microsoft.Dynamics.CRM.lookuplogicalname":"hub_center",
"_hub_center_value":"46ecf508-e26d-e711-80f2-c4346bacfbbc",
"hub_end_time@OData.Community.Display.V1.FormattedValue":"11:00 AM",
"hub_end_time":660,
"_hub_student_value@OData.Community.Display.V1.FormattedValue":"Harrison K",
"_hub_student_value@Microsoft.Dynamics.CRM.associatednavigationproperty":"hub_student",
"_hub_student_value@Microsoft.Dynamics.CRM.lookuplogicalname":"contact",
"_hub_student_value":"8f9876ad-8eae-e711-80fb-c4346bacfbbc",
"hub_sessiontype@OData.Community.Display.V1.FormattedValue":"Regular",
"hub_sessiontype":1,
"hub_name":"Harrison K - Bot Builders 101 for Girls - 10:00 AM - 11:00 AM",
"hub_late@OData.Community.Display.V1.FormattedValue":"No",
"hub_late":false,
"hub_start_time@OData.Community.Display.V1.FormattedValue":"10:00 AM",
"hub_start_time":600,
"hub_studentsessionid":"e96edc59-5bc3-e711-80ff-c4346bac4304",
"_hub_enrollment_value@OData.Community.Display.V1.FormattedValue":"Harrison K - Bot Builders 101 for Girls",
"_hub_enrollment_value@Microsoft.Dynamics.CRM.associatednavigationproperty":"hub_enrollment",
"_hub_enrollment_value@Microsoft.Dynamics.CRM.lookuplogicalname":"hub_enrollment",
"_hub_enrollment_value":"33821939-a7ae-e711-80fb-c4346bacfbbc",
"hub_session_status@OData.Community.Display.V1.FormattedValue":"Schedule",
"hub_session_status":1,
"aenrollment_x002e_hub_enrollmentstartdate@OData.Community.Display.V1.FormattedValue":"10/11/2017",
"aenrollment_x002e_hub_enrollmentstartdate":"2017-10-11T00:00:00Z",
"aprogram_x002e_hub_programid":"edd90c04-293f-e711-80ef-c4346bacfbbc",
"aprogram_x002e_hub_color":"#21D6BD",
"adeliverytype_x002e_hub_name":"Group Instruction",
"aenrollment_x002e_hub_name":"Harrison K - Bot Builders 101 for Girls",
"aenrollment_x002e_hub_enrollmentenddate@OData.Community.Display.V1.FormattedValue":"11/30/2017",
"aenrollment_x002e_hub_enrollmentenddate":"2017-11-30T00:00:00Z",
"aproductservice_x002e_hub_deliverytype@OData.Community.Display.V1.FormattedValue":"Group Instruction",
"aproductservice_x002e_hub_deliverytype":"f8b0e613-a534-e711-80ed-c4346bad526c",
"aenrollment_x002e_hub_enrollmentid":"33821939-a7ae-e711-80fb-c4346bacfbbc",
"aprogram_x002e_hub_name":"Bot Builders 101",
"aproductservice_x002e_hub_timeslottype@OData.Community.Display.V1.FormattedValue":"Standard",
"aproductservice_x002e_hub_timeslottype":1,
"astudent_x002e_hub_grade@OData.Community.Display.V1.FormattedValue":"10",
"astudent_x002e_hub_grade":12,
"adeliverytype_x002e_hub_code@OData.Community.Display.V1.FormattedValue":"GI",
"adeliverytype_x002e_hub_code":3,
"aproductservice_x002e_hub_duration@OData.Community.Display.V1.FormattedValue":"1 Hour",
"aproductservice_x002e_hub_duration":60
},
{
"@odata.etag":"W/\"4583963\"",
"hub_is_1to1@OData.Community.Display.V1.FormattedValue":"Yes",
"hub_is_1to1":true,
"_hub_service_value@OData.Community.Display.V1.FormattedValue":"Homework Help for summer",
"_hub_service_value@Microsoft.Dynamics.CRM.associatednavigationproperty":"hub_service",
"_hub_service_value@Microsoft.Dynamics.CRM.lookuplogicalname":"hub_productservice",
"_hub_service_value":"827c8125-ac77-e711-80f3-c4346bad526c",
"hub_isattended@OData.Community.Display.V1.FormattedValue":"No",
"hub_isattended":false,
"_hub_resourceid_value@OData.Community.Display.V1.FormattedValue":"Table-2",
"_hub_resourceid_value@Microsoft.Dynamics.CRM.associatednavigationproperty":"hub_resourceid",
"_hub_resourceid_value@Microsoft.Dynamics.CRM.lookuplogicalname":"hub_center_resources",
"_hub_resourceid_value":"1881f55a-ab77-e711-80f3-c4346bad526c",
"hub_session_date@OData.Community.Display.V1.FormattedValue":"12/14/2017",
"hub_session_date":"2017-12-14",
"_hub_center_value@OData.Community.Display.V1.FormattedValue":"Better Education, Inc.",
"_hub_center_value@Microsoft.Dynamics.CRM.associatednavigationproperty":"hub_center",
"_hub_center_value@Microsoft.Dynamics.CRM.lookuplogicalname":"hub_center",
"_hub_center_value":"46ecf508-e26d-e711-80f2-c4346bacfbbc",
"hub_end_time@OData.Community.Display.V1.FormattedValue":"11:00 AM",
"hub_end_time":660,
"_hub_student_value@OData.Community.Display.V1.FormattedValue":"Jacinta K",
"_hub_student_value@Microsoft.Dynamics.CRM.associatednavigationproperty":"hub_student",
"_hub_student_value@Microsoft.Dynamics.CRM.lookuplogicalname":"contact",
"_hub_student_value":"ac8726a8-ddad-e711-80fc-c4346badc680",
"hub_sessiontype@OData.Community.Display.V1.FormattedValue":"Regular",
"hub_sessiontype":1,
"hub_name":"Jacinta K - Homework Help for summer - 10:00 AM - 11:00 AM",
"hub_late@OData.Community.Display.V1.FormattedValue":"No",
"hub_late":false,
"hub_start_time@OData.Community.Display.V1.FormattedValue":"10:00 AM",
"hub_start_time":600,
"hub_studentsessionid":"e76edc59-5bc3-e711-80ff-c4346bac4304",
"_hub_enrollment_value@OData.Community.Display.V1.FormattedValue":"Jacinta K - Homework Help for summer",
"_hub_enrollment_value@Microsoft.Dynamics.CRM.associatednavigationproperty":"hub_enrollment",
"_hub_enrollment_value@Microsoft.Dynamics.CRM.lookuplogicalname":"hub_enrollment",
"_hub_enrollment_value":"6fd39543-dfad-e711-80fc-c4346badc680",
"hub_session_status@OData.Community.Display.V1.FormattedValue":"Schedule",
"hub_session_status":1,
"aenrollment_x002e_hub_enrollmentstartdate@OData.Community.Display.V1.FormattedValue":"10/10/2017",
"aenrollment_x002e_hub_enrollmentstartdate":"2017-10-10T00:00:00Z",
"aprogram_x002e_hub_color":"#21ADD6",
"adeliverytype_x002e_hub_name":"Personal Instruction",
"aenrollment_x002e_hub_name":"Jacinta K - Homework Help for summer",
"aprogram_x002e_hub_programid":"3456264c-bd3c-e711-80ef-c4346bac4304",
"aenrollment_x002e_hub_enrollmentenddate@OData.Community.Display.V1.FormattedValue":"12/31/2017",
"aenrollment_x002e_hub_enrollmentenddate":"2017-12-31T00:00:00Z",
"aproductservice_x002e_hub_deliverytype@OData.Community.Display.V1.FormattedValue":"Personal Instruction",
"aproductservice_x002e_hub_deliverytype":"d6c706eb-a534-e711-80ed-c4346bad526c",
"aenrollment_x002e_hub_enrollmentid":"6fd39543-dfad-e711-80fc-c4346badc680",
"aprogram_x002e_hub_name":"Homework Help",
"aproductservice_x002e_hub_timeslottype@OData.Community.Display.V1.FormattedValue":"Standard",
"aproductservice_x002e_hub_timeslottype":1,
"astudent_x002e_hub_grade@OData.Community.Display.V1.FormattedValue":"10",
"astudent_x002e_hub_grade":12,
"adeliverytype_x002e_hub_code@OData.Community.Display.V1.FormattedValue":"PI",
"adeliverytype_x002e_hub_code":1,
"aproductservice_x002e_hub_duration@OData.Community.Display.V1.FormattedValue":"1 Hour",
"aproductservice_x002e_hub_duration":60
},
{
"@odata.etag":"W/\"5207802\"",
"hub_is_1to1@OData.Community.Display.V1.FormattedValue":"No",
"hub_is_1to1":false,
"_hub_service_value@OData.Community.Display.V1.FormattedValue":"College Prep Writing",
"_hub_service_value@Microsoft.Dynamics.CRM.associatednavigationproperty":"hub_service",
"_hub_service_value@Microsoft.Dynamics.CRM.lookuplogicalname":"hub_productservice",
"_hub_service_value":"bc750376-c3c1-e711-80ff-c4346bad526c",
"hub_isattended@OData.Community.Display.V1.FormattedValue":"No",
"hub_isattended":false,
"_hub_resourceid_value@OData.Community.Display.V1.FormattedValue":"Table-3",
"_hub_resourceid_value@Microsoft.Dynamics.CRM.associatednavigationproperty":"hub_resourceid",
"_hub_resourceid_value@Microsoft.Dynamics.CRM.lookuplogicalname":"hub_center_resources",
"_hub_resourceid_value":"e412b76d-037e-e711-80f4-c4346bad526c",
"hub_session_date@OData.Community.Display.V1.FormattedValue":"12/14/2017",
"hub_session_date":"2017-12-14",
"_hub_center_value@OData.Community.Display.V1.FormattedValue":"Better Education, Inc.",
"_hub_center_value@Microsoft.Dynamics.CRM.associatednavigationproperty":"hub_center",
"_hub_center_value@Microsoft.Dynamics.CRM.lookuplogicalname":"hub_center",
"_hub_center_value":"46ecf508-e26d-e711-80f2-c4346bacfbbc",
"hub_end_time@OData.Community.Display.V1.FormattedValue":"7:00 PM",
"hub_end_time":1140,
"_hub_student_value@OData.Community.Display.V1.FormattedValue":"Jack Lim",
"_hub_student_value@Microsoft.Dynamics.CRM.associatednavigationproperty":"hub_student",
"_hub_student_value@Microsoft.Dynamics.CRM.lookuplogicalname":"contact",
"_hub_student_value":"f936ed3f-e68e-e711-80f7-c4346bacfbbc",
"hub_sessiontype@OData.Community.Display.V1.FormattedValue":"Regular",
"hub_sessiontype":1,
"hub_name":"Jack Lim - College Prep Writing-5:30 PM-7:00 PM",
"hub_late@OData.Community.Display.V1.FormattedValue":"No",
"hub_late":false,
"hub_start_time@OData.Community.Display.V1.FormattedValue":"5:30 PM",
"hub_start_time":1050,
"hub_studentsessionid":"b426e6de-a5ce-e711-8116-fc15b42826a0",
"_hub_enrollment_value@OData.Community.Display.V1.FormattedValue":"Jack Lim - College Prep Writing",
"_hub_enrollment_value@Microsoft.Dynamics.CRM.associatednavigationproperty":"hub_enrollment",
"_hub_enrollment_value@Microsoft.Dynamics.CRM.lookuplogicalname":"hub_enrollment",
"_hub_enrollment_value":"00832bc5-a5ce-e711-8100-c4346bad526c",
"hub_session_status@OData.Community.Display.V1.FormattedValue":"Schedule",
"hub_session_status":1,
"aenrollment_x002e_hub_enrollmentstartdate@OData.Community.Display.V1.FormattedValue":"11/19/2017",
"aenrollment_x002e_hub_enrollmentstartdate":"2017-11-19T00:00:00Z",
"aprogram_x002e_hub_color":"#C8D621",
"adeliverytype_x002e_hub_name":"Personal Instruction",
"aenrollment_x002e_hub_name":"Jack Lim - College Prep Writing",
"aproductservice_x002e_hub_deliverytype@OData.Community.Display.V1.FormattedValue":"Personal Instruction",
"aproductservice_x002e_hub_deliverytype":"d6c706eb-a534-e711-80ed-c4346bad526c",
"aenrollment_x002e_hub_enrollmentid":"00832bc5-a5ce-e711-8100-c4346bad526c",
"aprogram_x002e_hub_name":"College Prep Writing: English 101",
"aprogram_x002e_hub_programid":"86d15aca-a534-e711-80ed-c4346bad526c",
"aproductservice_x002e_hub_timeslottype@OData.Community.Display.V1.FormattedValue":"Standard",
"aproductservice_x002e_hub_timeslottype":1,
"astudent_x002e_hub_grade@OData.Community.Display.V1.FormattedValue":"10",
"astudent_x002e_hub_grade":12,
"adeliverytype_x002e_hub_code@OData.Community.Display.V1.FormattedValue":"PI",
"adeliverytype_x002e_hub_code":1,
"aproductservice_x002e_hub_duration@OData.Community.Display.V1.FormattedValue":"1 Hour",
"aproductservice_x002e_hub_duration":60
},
{
"@odata.etag":"W/\"5207909\"",
"hub_is_1to1@OData.Community.Display.V1.FormattedValue":"No",
"hub_is_1to1":false,
"_hub_service_value@OData.Community.Display.V1.FormattedValue":"Homework Help for winter",
"_hub_service_value@Microsoft.Dynamics.CRM.associatednavigationproperty":"hub_service",
"_hub_service_value@Microsoft.Dynamics.CRM.lookuplogicalname":"hub_productservice",
"_hub_service_value":"df4d6b65-5da8-e711-80f9-c4346bad526c",
"hub_isattended@OData.Community.Display.V1.FormattedValue":"No",
"hub_isattended":false,
"_hub_resourceid_value@OData.Community.Display.V1.FormattedValue":"Table-2",
"_hub_resourceid_value@Microsoft.Dynamics.CRM.associatednavigationproperty":"hub_resourceid",
"_hub_resourceid_value@Microsoft.Dynamics.CRM.lookuplogicalname":"hub_center_resources",
"_hub_resourceid_value":"1881f55a-ab77-e711-80f3-c4346bad526c",
"hub_session_date@OData.Community.Display.V1.FormattedValue":"12/14/2017",
"hub_session_date":"2017-12-14",
"_hub_center_value@OData.Community.Display.V1.FormattedValue":"Better Education, Inc.",
"_hub_center_value@Microsoft.Dynamics.CRM.associatednavigationproperty":"hub_center",
"_hub_center_value@Microsoft.Dynamics.CRM.lookuplogicalname":"hub_center",
"_hub_center_value":"46ecf508-e26d-e711-80f2-c4346bacfbbc",
"hub_end_time@OData.Community.Display.V1.FormattedValue":"10:15 AM",
"hub_end_time":615,
"_hub_student_value@OData.Community.Display.V1.FormattedValue":"Juli Robert",
"_hub_student_value@Microsoft.Dynamics.CRM.associatednavigationproperty":"hub_student",
"_hub_student_value@Microsoft.Dynamics.CRM.lookuplogicalname":"contact",
"_hub_student_value":"c6d4e0b5-45ab-e711-80fb-c4346bad526c",
"hub_sessiontype@OData.Community.Display.V1.FormattedValue":"Regular",
"hub_sessiontype":1,
"hub_name":"Juli Robert - Homework Help for winter-9:15 AM-10:15 AM",
"hub_late@OData.Community.Display.V1.FormattedValue":"No",
"hub_late":false,
"hub_start_time@OData.Community.Display.V1.FormattedValue":"9:15 AM",
"hub_start_time":555,
"hub_studentsessionid":"37055252-a7ce-e711-811b-c4346bada738",
"_hub_enrollment_value@OData.Community.Display.V1.FormattedValue":"Juli Robert - Homework Help for winter",
"_hub_enrollment_value@Microsoft.Dynamics.CRM.associatednavigationproperty":"hub_enrollment",
"_hub_enrollment_value@Microsoft.Dynamics.CRM.lookuplogicalname":"hub_enrollment",
"_hub_enrollment_value":"2fb66fbb-a6ce-e711-8100-c4346bad526c",
"hub_session_status@OData.Community.Display.V1.FormattedValue":"Schedule",
"hub_session_status":1,
"aenrollment_x002e_hub_enrollmentstartdate@OData.Community.Display.V1.FormattedValue":"11/19/2017",
"aenrollment_x002e_hub_enrollmentstartdate":"2017-11-19T00:00:00Z",
"aprogram_x002e_hub_color":"#21ADD6",
"adeliverytype_x002e_hub_name":"Personal Instruction",
"aenrollment_x002e_hub_name":"Juli Robert - Homework Help for winter",
"aproductservice_x002e_hub_deliverytype@OData.Community.Display.V1.FormattedValue":"Personal Instruction",
"aproductservice_x002e_hub_deliverytype":"d6c706eb-a534-e711-80ed-c4346bad526c",
"aenrollment_x002e_hub_enrollmentid":"2fb66fbb-a6ce-e711-8100-c4346bad526c",
"aprogram_x002e_hub_name":"Homework Help",
"aprogram_x002e_hub_programid":"3456264c-bd3c-e711-80ef-c4346bac4304",
"aproductservice_x002e_hub_timeslottype@OData.Community.Display.V1.FormattedValue":"Standard",
"aproductservice_x002e_hub_timeslottype":1,
"astudent_x002e_hub_grade@OData.Community.Display.V1.FormattedValue":"5",
"astudent_x002e_hub_grade":7,
"adeliverytype_x002e_hub_code@OData.Community.Display.V1.FormattedValue":"PI",
"adeliverytype_x002e_hub_code":1,
"aproductservice_x002e_hub_duration@OData.Community.Display.V1.FormattedValue":"1 Hour",
"aproductservice_x002e_hub_duration":60
},
{
"@odata.etag":"W/\"5312025\"",
"hub_is_1to1@OData.Community.Display.V1.FormattedValue":"No",
"hub_is_1to1":false,
"_hub_service_value@OData.Community.Display.V1.FormattedValue":"College Prep Writing",
"_hub_service_value@Microsoft.Dynamics.CRM.associatednavigationproperty":"hub_service",
"_hub_service_value@Microsoft.Dynamics.CRM.lookuplogicalname":"hub_productservice",
"_hub_service_value":"bc750376-c3c1-e711-80ff-c4346bad526c",
"hub_isattended@OData.Community.Display.V1.FormattedValue":"No",
"hub_isattended":false,
"_hub_resourceid_value@OData.Community.Display.V1.FormattedValue":"Table-3",
"_hub_resourceid_value@Microsoft.Dynamics.CRM.associatednavigationproperty":"hub_resourceid",
"_hub_resourceid_value@Microsoft.Dynamics.CRM.lookuplogicalname":"hub_center_resources",
"_hub_resourceid_value":"e412b76d-037e-e711-80f4-c4346bad526c",
"hub_session_date@OData.Community.Display.V1.FormattedValue":"12/14/2017",
"hub_session_date":"2017-12-14",
"_hub_center_value@OData.Community.Display.V1.FormattedValue":"Better Education, Inc.",
"_hub_center_value@Microsoft.Dynamics.CRM.associatednavigationproperty":"hub_center",
"_hub_center_value@Microsoft.Dynamics.CRM.lookuplogicalname":"hub_center",
"_hub_center_value":"46ecf508-e26d-e711-80f2-c4346bacfbbc",
"hub_end_time@OData.Community.Display.V1.FormattedValue":"7:00 PM",
"hub_end_time":1140,
"_hub_student_value@OData.Community.Display.V1.FormattedValue":"Justin R Dsouza",
"_hub_student_value@Microsoft.Dynamics.CRM.associatednavigationproperty":"hub_student",
"_hub_student_value@Microsoft.Dynamics.CRM.lookuplogicalname":"contact",
"_hub_student_value":"6e252515-30d0-e711-8101-c4346bad526c",
"hub_sessiontype@OData.Community.Display.V1.FormattedValue":"Regular",
"hub_sessiontype":1,
"hub_name":"Justin R Dsouza - College Prep Writing-5:30 PM-7:00 PM",
"hub_late@OData.Community.Display.V1.FormattedValue":"No",
"hub_late":false,
"hub_start_time@OData.Community.Display.V1.FormattedValue":"5:30 PM",
"hub_start_time":1050,
"hub_studentsessionid":"80c71c8c-60da-e711-811c-c4346bada738",
"_hub_enrollment_value@OData.Community.Display.V1.FormattedValue":"Justin R Dsouza - College Prep Writing",
"_hub_enrollment_value@Microsoft.Dynamics.CRM.associatednavigationproperty":"hub_enrollment",
"_hub_enrollment_value@Microsoft.Dynamics.CRM.lookuplogicalname":"hub_enrollment",
"_hub_enrollment_value":"768d415b-30d0-e711-8101-c4346bad526c",
"hub_session_status@OData.Community.Display.V1.FormattedValue":"Schedule",
"hub_session_status":1,
"aenrollment_x002e_hub_enrollmentstartdate@OData.Community.Display.V1.FormattedValue":"11/14/2017",
"aenrollment_x002e_hub_enrollmentstartdate":"2017-11-14T00:00:00Z",
"aprogram_x002e_hub_color":"#C8D621",
"adeliverytype_x002e_hub_name":"Personal Instruction",
"aenrollment_x002e_hub_name":"Justin R Dsouza - College Prep Writing",
"aprogram_x002e_hub_programid":"86d15aca-a534-e711-80ed-c4346bad526c",
"aenrollment_x002e_hub_enrollmentenddate@OData.Community.Display.V1.FormattedValue":"12/31/2017",
"aenrollment_x002e_hub_enrollmentenddate":"2017-12-31T00:00:00Z",
"aproductservice_x002e_hub_deliverytype@OData.Community.Display.V1.FormattedValue":"Personal Instruction",
"aproductservice_x002e_hub_deliverytype":"d6c706eb-a534-e711-80ed-c4346bad526c",
"aenrollment_x002e_hub_enrollmentid":"768d415b-30d0-e711-8101-c4346bad526c",
"aprogram_x002e_hub_name":"College Prep Writing: English 101",
"aproductservice_x002e_hub_timeslottype@OData.Community.Display.V1.FormattedValue":"Standard",
"aproductservice_x002e_hub_timeslottype":1,
"astudent_x002e_hub_grade@OData.Community.Display.V1.FormattedValue":"10",
"astudent_x002e_hub_grade":12,
"adeliverytype_x002e_hub_code@OData.Community.Display.V1.FormattedValue":"PI",
"adeliverytype_x002e_hub_code":1,
"aproductservice_x002e_hub_duration@OData.Community.Display.V1.FormattedValue":"1 Hour",
"aproductservice_x002e_hub_duration":60
},
{
"@odata.etag":"W/\"4584167\"",
"hub_is_1to1@OData.Community.Display.V1.FormattedValue":"No",
"hub_is_1to1":false,
"_hub_service_value@OData.Community.Display.V1.FormattedValue":"Homework Help Spring",
"_hub_service_value@Microsoft.Dynamics.CRM.associatednavigationproperty":"hub_service",
"_hub_service_value@Microsoft.Dynamics.CRM.lookuplogicalname":"hub_productservice",
"_hub_service_value":"3061a696-c17a-e711-80f4-c4346bad526c",
"hub_isattended@OData.Community.Display.V1.FormattedValue":"No",
"hub_isattended":false,
"_hub_resourceid_value@OData.Community.Display.V1.FormattedValue":"Table-2",
"_hub_resourceid_value@Microsoft.Dynamics.CRM.associatednavigationproperty":"hub_resourceid",
"_hub_resourceid_value@Microsoft.Dynamics.CRM.lookuplogicalname":"hub_center_resources",
"_hub_resourceid_value":"1881f55a-ab77-e711-80f3-c4346bad526c",
"hub_session_date@OData.Community.Display.V1.FormattedValue":"12/14/2017",
"hub_session_date":"2017-12-14",
"_hub_center_value@OData.Community.Display.V1.FormattedValue":"Better Education, Inc.",
"_hub_center_value@Microsoft.Dynamics.CRM.associatednavigationproperty":"hub_center",
"_hub_center_value@Microsoft.Dynamics.CRM.lookuplogicalname":"hub_center",
"_hub_center_value":"46ecf508-e26d-e711-80f2-c4346bacfbbc",
"hub_end_time@OData.Community.Display.V1.FormattedValue":"6:00 PM",
"hub_end_time":1080,
"_hub_student_value@OData.Community.Display.V1.FormattedValue":"Ken Thomas",
"_hub_student_value@Microsoft.Dynamics.CRM.associatednavigationproperty":"hub_student",
"_hub_student_value@Microsoft.Dynamics.CRM.lookuplogicalname":"contact",
"_hub_student_value":"7b485625-e68e-e711-80f7-c4346bacfbbc",
"hub_sessiontype@OData.Community.Display.V1.FormattedValue":"Regular",
"hub_sessiontype":1,
"hub_name":"Ken Thomas - Homework Help Spring - 5:30 PM - 6:00 PM",
"hub_late@OData.Community.Display.V1.FormattedValue":"No",
"hub_late":false,
"hub_start_time@OData.Community.Display.V1.FormattedValue":"5:30 PM",
"hub_start_time":1050,
"hub_studentsessionid":"46037479-5bc3-e711-80ff-c4346bac4304",
"_hub_enrollment_value@OData.Community.Display.V1.FormattedValue":"Ken Thomas - Homework Help Spring",
"_hub_enrollment_value@Microsoft.Dynamics.CRM.associatednavigationproperty":"hub_enrollment",
"_hub_enrollment_value@Microsoft.Dynamics.CRM.lookuplogicalname":"hub_enrollment",
"_hub_enrollment_value":"77f9b25b-ef8e-e711-80f7-c4346bacfbbc",
"hub_session_status@OData.Community.Display.V1.FormattedValue":"Schedule",
"hub_session_status":1,
"aenrollment_x002e_hub_enrollmentstartdate@OData.Community.Display.V1.FormattedValue":"9/1/2017",
"aenrollment_x002e_hub_enrollmentstartdate":"2017-09-01T00:00:00Z",
"aprogram_x002e_hub_color":"#55D621",
"adeliverytype_x002e_hub_name":"Personal Instruction",
"aenrollment_x002e_hub_name":"Ken Thomas - Homework Help Spring",
"aproductservice_x002e_hub_deliverytype@OData.Community.Display.V1.FormattedValue":"Personal Instruction",
"aproductservice_x002e_hub_deliverytype":"d6c706eb-a534-e711-80ed-c4346bad526c",
"aenrollment_x002e_hub_enrollmentid":"77f9b25b-ef8e-e711-80f7-c4346bacfbbc",
"aprogram_x002e_hub_name":"Homework Help 1",
"aprogram_x002e_hub_programid":"f1d1c2f3-a571-e711-80f2-c4346bac4304",
"aproductservice_x002e_hub_timeslottype@OData.Community.Display.V1.FormattedValue":"Standard",
"aproductservice_x002e_hub_timeslottype":1,
"astudent_x002e_hub_grade@OData.Community.Display.V1.FormattedValue":"6",
"astudent_x002e_hub_grade":8,
"adeliverytype_x002e_hub_code@OData.Community.Display.V1.FormattedValue":"PI",
"adeliverytype_x002e_hub_code":1,
"aproductservice_x002e_hub_duration@OData.Community.Display.V1.FormattedValue":"1 Hour",
"aproductservice_x002e_hub_duration":60
},
{
"@odata.etag":"W/\"4583966\"",
"hub_is_1to1@OData.Community.Display.V1.FormattedValue":"No",
"hub_is_1to1":false,
"_hub_service_value@OData.Community.Display.V1.FormattedValue":"Bot Builders 101 for Girls",
"_hub_service_value@Microsoft.Dynamics.CRM.associatednavigationproperty":"hub_service",
"_hub_service_value@Microsoft.Dynamics.CRM.lookuplogicalname":"hub_productservice",
"_hub_service_value":"49b74d1e-9c97-e711-80f9-c4346badc680",
"hub_isattended@OData.Community.Display.V1.FormattedValue":"No",
"hub_isattended":false,
"hub_session_date@OData.Community.Display.V1.FormattedValue":"12/14/2017",
"hub_session_date":"2017-12-14",
"_hub_center_value@OData.Community.Display.V1.FormattedValue":"Better Education, Inc.",
"_hub_center_value@Microsoft.Dynamics.CRM.associatednavigationproperty":"hub_center",
"_hub_center_value@Microsoft.Dynamics.CRM.lookuplogicalname":"hub_center",
